MarketId,MarketName,MarketRating,MarketAddress,MarketPrice,UrlImageProfile,LinkDetail
863,ตลาดนัดคลองถมสตาร์ระยอง,4.60 (84),"เมืองนครปฐม, นครปฐม",,https://dx0z0m6vobblr.cloudfront.net/markets/ตลาดนัดคลองถมสตาร์ระยอง/1.jpg,https://thaimarket.biz/markets/ตลาดนัดคลองถมสตาร์ระยอง
864,ตลาดฉัตรไชย,"4.30 (2,555)","เมืองนครปฐม, นครปฐม",,https://dx0z0m6vobblr.cloudfront.net/markets/ตลาดฉัตรไชย/1-9-800x445.jpg,https://thaimarket.biz/markets/ตลาดฉัตรไชย
865,ตลาดนัดลำลูกกา คลอง 7,0.00 (0),"ลำลูกกา, ปทุมธานี",,https://dx0z0m6vobblr.cloudfront.net/markets/ตลาดนัดลำลูกกา-คลอง-7/No-06649-à¸­à¸²à¸à¸²à¸£à¸à¸²à¸à¸´à¸à¸¢à¹à¸à¸¥à¸²à¸à¹à¸«à¸à¹à¸¥à¸³à¸¥à¸¹à¸à¸à¸²à¸à¸¥à¸­à¸7à¸à¸²à¸_2107_22.jpg,https://thaimarket.biz/markets/ตลาดนัดลำลูกกา-คลอง-7
866,ตลาดนัด Vintage @ตลาดชัชวาล คลอง 7,4.30 (172),"ลำลูกกา, ปทุมธานี",,https://dx0z0m6vobblr.cloudfront.net/markets/ตลาดนัด-vintage-ตลาดชัชวาล-คลอง-7/IMG_20210620_184953.jpg,https://thaimarket.biz/markets/ตลาดนัด-vintage-ตลาดชัชวาล-คลอง-7
867,ตลาดสดเสาธง,4.20 (90),"ลำลูกกา, ปทุมธานี",,https://dx0z0m6vobblr.cloudfront.net/markets/ตลาดสดเสาธง/3.jpg,https://thaimarket.biz/markets/ตลาดสดเสาธง
868,ตลาดนัดมหาวิทยาลัยศิลปากร ตลาดเกษตรกร,3.00 (1),"ลำลูกกา, ปทุมธานี",,https://dx0z0m6vobblr.cloudfront.net/markets/ตลาดนัดมหาวิทยาลัยศิลปากร-ตลาดเกษตรกร/21211.jpg,https://thaimarket.biz/markets/ตลาดนัดมหาวิทยาลัยศิลปากร-ตลาดเกษตรกร
869,ตลาดนัดเมืองใหม่มาบตาพุด,4.20 (725),"ลำลูกกา, ปทุมธานี",,https://dx0z0m6vobblr.cloudfront.net/markets/ตลาดนัดเมืองใหม่มาบตาพุด/3.jpg,https://thaimarket.biz/markets/ตลาดนัดเมืองใหม่มาบตาพุด
870,ตลาดอบต.นาตาขวัญ,4.10 (341),"ลำลูกกา, ปทุมธานี",,https://dx0z0m6vobblr.cloudfront.net/markets/ตลาดอบต-นาตาขวัญ/1.jpg,https://thaimarket.biz/markets/ตลาดอบต-นาตาขวัญ
871,ตลาดลานปูน,"4.10 (1,294)","ลำลูกกา, ปทุมธานี",,https://dx0z0m6vobblr.cloudfront.net/markets/ตลาดลานปูน/5.jpg,https://thaimarket.biz/markets/ตลาดลานปูน
872,ตลาดเกาะกลอย,4.10 (81),"ลำลูกกา, ปทุมธานี",,https://dx0z0m6vobblr.cloudfront.net/markets/ตลาดเกาะกลอย/2.jpg,https://thaimarket.biz/markets/ตลาดเกาะกลอย
873,ตลาดนัดแยกประชาเกษม,"4.10 (1,288)","ลำลูกกา, ปทุมธานี",,https://dx0z0m6vobblr.cloudfront.net/markets/ตลาดนัดแยกประชาเกษม/223322.jpg,https://thaimarket.biz/markets/ตลาดนัดแยกประชาเกษม
874,ตลาดท้ายเขื่อนขุนด่านปราการชล,4.60 (49),"ลำลูกกา, ปทุมธานี",,https://dx0z0m6vobblr.cloudfront.net/markets/ตลาดท้ายเขื่อนขุนด่านปราการชล/11111.jpg,https://thaimarket.biz/markets/ตลาดท้ายเขื่อนขุนด่านปราการชล
875,ตลาดคนนอง,4.10 (234),"ลำลูกกา, ปทุมธานี",,https://dx0z0m6vobblr.cloudfront.net/markets/ตลาดคนนอง/1.jpg,https://thaimarket.biz/markets/ตลาดคนนอง
876,ตลาดริมห้วย,4.40 (277),"ลำลูกกา, ปทุมธานี",,https://dx0z0m6vobblr.cloudfront.net/markets/ตลาดริมห้วย/44554.jpg,https://thaimarket.biz/markets/ตลาดริมห้วย
877,ตลาดธารโต,0.00 (0),"ธารโต, ยะลา",,https://dx0z0m6vobblr.cloudfront.net/markets/ตลาดธารโต/1.jpg,https://thaimarket.biz/markets/ตลาดธารโต
878,ตลาดนัดอำเภอรามัน,0.00 (0),"ธารโต, ยะลา",,https://dx0z0m6vobblr.cloudfront.net/markets/ตลาดนัดอำเภอรามัน/3.jpg,https://thaimarket.biz/markets/ตลาดนัดอำเภอรามัน
879,ตลาดนัดมารวย  ปทุมธานี,0.00 (0),"ธารโต, ยะลา",,https://dx0z0m6vobblr.cloudfront.net/markets/ตลาดนัดมารวย/2019-09-23.jpg,https://thaimarket.biz/markets/ตลาดนัดมารวย
880,ตลาดนัดสานตม,4.30 (23),"ธารโต, ยะลา",,https://dx0z0m6vobblr.cloudfront.net/markets/ตลาดนัดสานตม/à¸à¸¥à¸²à¸à¸ªà¸à¹à¸à¸¨à¸à¸²à¸¥à¸ à¸¹à¹à¸£à¸·à¸­ 2.jpg,https://thaimarket.biz/markets/ตลาดนัดสานตม
881,ตลาดนัดบ้านบาโงย,3.60 (8),"ธารโต, ยะลา",,https://dx0z0m6vobblr.cloudfront.net/markets/ตลาดนัดบ้านบาโงย/2.jpg,https://thaimarket.biz/markets/ตลาดนัดบ้านบาโงย
882,ตลาดสดสุทธิพาณิชย์(ตลาดพุเตย),4.10 (282),"ธารโต, ยะลา",,https://dx0z0m6vobblr.cloudfront.net/markets/ตลาดสดสุทธิพาณิชย์-ตลาดพุเตย-/2023-02-23.jpg,https://thaimarket.biz/markets/ตลาดสดสุทธิพาณิชย์-ตลาดพุเตย-
883,ตลาดสดบ้านกลาง,3.80 (235),"ธารโต, ยะลา",,https://dx0z0m6vobblr.cloudfront.net/markets/ตลาดสดบ้านกลาง/000.png,https://thaimarket.biz/markets/ตลาดสดบ้านกลาง
884,ถนนคนเดินเทศบาลตำบลอุ้มผาง,4.00 (2),"ธารโต, ยะลา",,https://dx0z0m6vobblr.cloudfront.net/markets/ถนนคนเดินเทศบาลตำบลอุ้มผาง/2223332.jpg,https://thaimarket.biz/markets/ถนนคนเดินเทศบาลตำบลอุ้มผาง
885,ตลาดวังพิกุล,0.00 (0),"ธารโต, ยะลา",,https://dx0z0m6vobblr.cloudfront.net/markets/ตลาดวังพิกุล/000.png,https://thaimarket.biz/markets/ตลาดวังพิกุล
886,ตลาดสดศรีมนูญ,4.10 (149),"ธารโต, ยะลา",,https://dx0z0m6vobblr.cloudfront.net/markets/ตลาดสดศรีมนูญ/2017-12-13 (1).jpg,https://thaimarket.biz/markets/ตลาดสดศรีมนูญ
887,ตลาดนัด ส.ว.  สงขลา,4.30 (20),"ธารโต, ยะลา",,https://dx0z0m6vobblr.cloudfront.net/markets/ตลาดนัด-ส-ว-สงขลา/2018-03-16.jpg,https://thaimarket.biz/markets/ตลาดนัด-ส-ว-สงขลา
888,ตลาดเเสนตุ้ง,4.00 (978),"ธารโต, ยะลา",,https://dx0z0m6vobblr.cloudfront.net/markets/ตลาดเเสนตุ้ง/11111.jpg,https://thaimarket.biz/markets/ตลาดเเสนตุ้ง
889,ตลาดสดเทศบาลตำบลฟ้าหยาด,4.70 (9),"มหาชนะชัย, ยโสธร",,https://dx0z0m6vobblr.cloudfront.net/markets/ตลาดสดเทศบาลตำบลฟ้าหยาด/4.jpg,https://thaimarket.biz/markets/ตลาดสดเทศบาลตำบลฟ้าหยาด
890,ตลาดสดเทศบาลตำบลเขาสมิง,4.40 (11),"มหาชนะชัย, ยโสธร",,https://dx0z0m6vobblr.cloudfront.net/markets/ตลาดสดเทศบาลตำบลเขาสมิง/11111.jpg,https://thaimarket.biz/markets/ตลาดสดเทศบาลตำบลเขาสมิง
891,ตลาดสุขจันทร์,4.00 (145),"มหาชนะชัย, ยโสธร",,https://dx0z0m6vobblr.cloudfront.net/markets/ตลาดสุขจันทร์/2017-02-25.jpg,https://thaimarket.biz/markets/ตลาดสุขจันทร์
892,ตลาดเปิดท้ายนาโยง,1.80 (25),"มหาชนะชัย, ยโสธร",,https://dx0z0m6vobblr.cloudfront.net/markets/ตลาดเปิดท้ายนาโยง/11111.jpg,https://thaimarket.biz/markets/ตลาดเปิดท้ายนาโยง
893,ตลาดสดเทศบาลตำบลป่าติ้ว,0.00 (0),"มหาชนะชัย, ยโสธร",,https://dx0z0m6vobblr.cloudfront.net/markets/ตลาดสดเทศบาลตำบลป่าติ้ว/1.jpg,https://thaimarket.biz/markets/ตลาดสดเทศบาลตำบลป่าติ้ว
894,ตลาดสุทธินนท์,4.30 (13),"มหาชนะชัย, ยโสธร",,https://dx0z0m6vobblr.cloudfront.net/markets/ตลาดสุทธินนท์/11111.jpg,https://thaimarket.biz/markets/ตลาดสุทธินนท์
895,ตลาดมรกต 2,3.70 (28),"มหาชนะชัย, ยโสธร",,https://dx0z0m6vobblr.cloudfront.net/markets/ตลาดมรกต-2/11111.jpeg,https://thaimarket.biz/markets/ตลาดมรกต-2
896,ตลาดสดดงขุย,4.80 (12),"มหาชนะชัย, ยโสธร",,https://dx0z0m6vobblr.cloudfront.net/markets/ตลาดสดดงขุย/000.png,https://thaimarket.biz/markets/ตลาดสดดงขุย
897,ตลาดสุขใจไทหล่มเก่า,5.00 (1),"มหาชนะชัย, ยโสธร",,https://dx0z0m6vobblr.cloudfront.net/markets/ตลาดสุขใจไทหล่มเก่า/2022-09-03 (1).jpg,https://thaimarket.biz/markets/ตลาดสุขใจไทหล่มเก่า
898,ตลาดสันติสุข เพชรบูรณ์,4.30 (142),"มหาชนะชัย, ยโสธร",,https://dx0z0m6vobblr.cloudfront.net/markets/ตลาดสันติสุข/GWVh703tezaxdp6.jpg,https://thaimarket.biz/markets/ตลาดสันติสุข
899,ตลาดนัดสุรพลบุ่งคล้า,0.00 (0),"มหาชนะชัย, ยโสธร",,https://dx0z0m6vobblr.cloudfront.net/markets/ตลาดนัดสุรพลบุ่งคล้า/{1169AF89-7AB9-45C4-84B8-D7C9B1C11929}.png,https://thaimarket.biz/markets/ตลาดนัดสุรพลบุ่งคล้า
900,ตลาดนัดชุมชนน้ำก้อ,5.00 (4),"มหาชนะชัย, ยโสธร",,https://dx0z0m6vobblr.cloudfront.net/markets/ตลาดนัดชุมชนน้ำก้อ/000.png,https://thaimarket.biz/markets/ตลาดนัดชุมชนน้ำก้อ
901,ตลาดกลางสหกรณ์การเกษตรบ้านลาด จำกัด,0.00 (0),"บ้านลาด, เพชรบุรี",,https://dx0z0m6vobblr.cloudfront.net/markets/ตลาดกลางสหกรณ์การเกษตรบ้านลาด-จำกัด/000.png,https://thaimarket.biz/markets/ตลาดกลางสหกรณ์การเกษตรบ้านลาด-จำกัด
902,ตลากกลางหนองบ้วย,4.20 (464),"บ้านลาด, เพชรบุรี",,https://dx0z0m6vobblr.cloudfront.net/markets/ตลากกลางหนองบ้วย/000.png,https://thaimarket.biz/markets/ตลากกลางหนองบ้วย
903,ตลาดเทศบาลท่ายาง,4.00 (116),"บ้านลาด, เพชรบุรี",,https://dx0z0m6vobblr.cloudfront.net/markets/ตลาดเทศบาลท่ายาง/000.png,https://thaimarket.biz/markets/ตลาดเทศบาลท่ายาง
904,ตลาดสดเทศบาลชะอำ,"4.20 (3,067)","บ้านลาด, เพชรบุรี",,https://dx0z0m6vobblr.cloudfront.net/markets/ตลาดสดเทศบาลชะอำ/IMG_20220510_153536.jpg,https://thaimarket.biz/markets/ตลาดสดเทศบาลชะอำ
905,ถนนคนเดินเชียงแสน,5.00 (1),"บ้านลาด, เพชรบุรี",,https://dx0z0m6vobblr.cloudfront.net/markets/ถนนคนเดินเชียงแสน/01010.png,https://thaimarket.biz/markets/ถนนคนเดินเชียงแสน
906,ถนนคนเดินแม่จัน,4.60 (44),"บ้านลาด, เพชรบุรี",,https://dx0z0m6vobblr.cloudfront.net/markets/ถนนคนเดินแม่จัน/000.png,https://thaimarket.biz/markets/ถนนคนเดินแม่จัน
907,ตลาดนัดวัดแม่เตาไห,4.40 (39),"บ้านลาด, เพชรบุรี",,https://dx0z0m6vobblr.cloudfront.net/markets/ตลาดนัดวัดแม่เตาไห/00303030330.png,https://thaimarket.biz/markets/ตลาดนัดวัดแม่เตาไห
908,ตลาดนัดฟีนิกซ์แม่โจ้,2.40 (242),"บ้านลาด, เพชรบุรี",,https://dx0z0m6vobblr.cloudfront.net/markets/ตลาดนัดฟีนิกซ์แม่โจ้/000.png,https://thaimarket.biz/markets/ตลาดนัดฟีนิกซ์แม่โจ้
909,ตลาดนัดสันทราย,0.00 (0),"บ้านลาด, เพชรบุรี",,https://dx0z0m6vobblr.cloudfront.net/markets/ตลาดนัดสันทราย/000.png,https://thaimarket.biz/markets/ตลาดนัดสันทราย
910,ตลาดนัดคาวบอย,0.00 (0),"บ้านลาด, เพชรบุรี",,https://dx0z0m6vobblr.cloudfront.net/markets/ตลาดนัดคาวบอย/000.png,https://thaimarket.biz/markets/ตลาดนัดคาวบอย
911,ตลาดเกษตรแม่โจ้,4.20 (42),"บ้านลาด, เพชรบุรี",,https://dx0z0m6vobblr.cloudfront.net/markets/ตลาดเกษตรแม่โจ้/000.png,https://thaimarket.biz/markets/ตลาดเกษตรแม่โจ้
912,กาดแม่โจ้สามัคคีโซนเหลือง,4.10 (625),"บ้านลาด, เพชรบุรี",,https://dx0z0m6vobblr.cloudfront.net/markets/กาดแม่โจ้สามัคคีโซนเหลือง/000.png,https://thaimarket.biz/markets/กาดแม่โจ้สามัคคีโซนเหลือง
913,ตลาดหลิ่งมื่นมาร์เก็ต,4.80 (16),"สันทราย, เชียงใหม่",,https://dx0z0m6vobblr.cloudfront.net/markets/ตลาดหลิ่งมื่นมาร์เก็ต/020202.png,https://thaimarket.biz/markets/ตลาดหลิ่งมื่นมาร์เก็ต
914,ตลาดชุมชนวัดแม่แก้ด,4.20 (22),"สันทราย, เชียงใหม่",,https://dx0z0m6vobblr.cloudfront.net/markets/ตลาดชุมชนวัดแม่แก้ด/000.png,https://thaimarket.biz/markets/ตลาดชุมชนวัดแม่แก้ด
915,ตลาดนัดแม่กวง,4.30 (43),"สันทราย, เชียงใหม่",,https://dx0z0m6vobblr.cloudfront.net/markets/ตลาดนัดแม่กวง/000.png,https://thaimarket.biz/markets/ตลาดนัดแม่กวง
916,ตลาดสดเทศบาล 2 นครศรีธรรมราช,3.90 (251),"สันทราย, เชียงใหม่",,https://dx0z0m6vobblr.cloudfront.net/markets/ตลาดสดเทศบาล-2/111.jpg,https://thaimarket.biz/markets/ตลาดสดเทศบาล-2
917,ตลาดบัวขาว,0.00 (0),"สันทราย, เชียงใหม่",,https://dx0z0m6vobblr.cloudfront.net/markets/ตลาดบัวขาว/1111.jpg,https://thaimarket.biz/markets/ตลาดบัวขาว
918,ตลาดนัดบัวใหญ่,4.60 (21),"สันทราย, เชียงใหม่",,https://dx0z0m6vobblr.cloudfront.net/markets/ตลาดนัดบัวใหญ่/1111.jpg,https://thaimarket.biz/markets/ตลาดนัดบัวใหญ่
919,ตลาดสดเทศบาลตำบลโนนสูง,4.40 (16),"สันทราย, เชียงใหม่",,https://dx0z0m6vobblr.cloudfront.net/markets/ตลาดสดเทศบาลตำบลโนนสูง/asdzca.jpg,https://thaimarket.biz/markets/ตลาดสดเทศบาลตำบลโนนสูง
920,ตลาดเย็นท่าช้างเฉลิมพระเกียรติ,4.50 (2),"สันทราย, เชียงใหม่",,https://dx0z0m6vobblr.cloudfront.net/markets/ตลาดเย็นท่าช้างเฉลิมพระเกียรติ/1111.jpg,https://thaimarket.biz/markets/ตลาดเย็นท่าช้างเฉลิมพระเกียรติ
921,ตลาดสดเฉลิมพระเกียรติ ตลาดเช้า,4.10 (127),"สันทราย, เชียงใหม่",,https://dx0z0m6vobblr.cloudfront.net/markets/ตลาดสดเฉลิมพระเกียรติ-ตลาดเช้า/qqwwxx.jpg,https://thaimarket.biz/markets/ตลาดสดเฉลิมพระเกียรติ-ตลาดเช้า
922,ตลาดเทศบาลขามทะเลสอ,4.60 (28),"สันทราย, เชียงใหม่",,https://dx0z0m6vobblr.cloudfront.net/markets/ตลาดเทศบาลขามทะเลสอ/11111cc.jpg,https://thaimarket.biz/markets/ตลาดเทศบาลขามทะเลสอ
923,ตลาดเย็นเทศบาลสูงเนิน,4.10 (120),"สันทราย, เชียงใหม่",,https://dx0z0m6vobblr.cloudfront.net/markets/ตลาดเย็นเทศบาลสูงเนิน/12122456.jpg,https://thaimarket.biz/markets/ตลาดเย็นเทศบาลสูงเนิน
924,ตลาดเช้าเทศบาลสูงเนิน,4.00 (492),"สันทราย, เชียงใหม่",,https://dx0z0m6vobblr.cloudfront.net/markets/ตลาดเช้าเทศบาลสูงเนิน/1111.jpg,https://thaimarket.biz/markets/ตลาดเช้าเทศบาลสูงเนิน
925,ตลาดท่าหินอาหารและเครื่องดื่ม,4.00 (4),"เมืองขอนแก่น, ขอนแก่น",,https://dx0z0m6vobblr.cloudfront.net/markets/ตลาดท่าหินอาหารและเครื่องดื่ม/423538596_122137113392082561_4337583005535217455_n.jpg,https://thaimarket.biz/markets/ตลาดท่าหินอาหารและเครื่องดื่ม
926,ตลาดบ้านโคกสี,4.10 (148),"เมืองขอนแก่น, ขอนแก่น",,https://dx0z0m6vobblr.cloudfront.net/markets/ตลาดบ้านโคกสี/Screenshot 2024-09-25 160633.png,https://thaimarket.biz/markets/ตลาดบ้านโคกสี
927,ตลาดสดบึงเนียม,4.30 (263),"เมืองขอนแก่น, ขอนแก่น",,https://dx0z0m6vobblr.cloudfront.net/markets/ตลาดสดบึงเนียม/2019-06-03.jpg,https://thaimarket.biz/markets/ตลาดสดบึงเนียม
928,ตลาดศิลามหานครขอนแก่น,4.40 (7),"เมืองขอนแก่น, ขอนแก่น",,https://dx0z0m6vobblr.cloudfront.net/markets/ตลาดศิลามหานครขอนแก่น/352672672_1688238378297013_5810173607550535721_n.jpg,https://thaimarket.biz/markets/ตลาดศิลามหานครขอนแก่น
929,ตลาดหอพัก 8 หลัง มข.,4.30 (66),"เมืองขอนแก่น, ขอนแก่น",,https://dx0z0m6vobblr.cloudfront.net/markets/ตลาดหอพัก-8-หลัง-มข-/Screenshot 2024-09-24 212633.png,https://thaimarket.biz/markets/ตลาดหอพัก-8-หลัง-มข-
930,ตลาดหนองใหญ่,4.20 (386),"เมืองขอนแก่น, ขอนแก่น",,https://dx0z0m6vobblr.cloudfront.net/markets/ตลาดหนองใหญ่/11e4f804b3e042ccaebf789f6c87dc9e.jpg,https://thaimarket.biz/markets/ตลาดหนองใหญ่
931,ตลาดมอดินแดง มหาวิทยาลัยขอนแก่น,4.50 (813),"เมืองขอนแก่น, ขอนแก่น",,https://dx0z0m6vobblr.cloudfront.net/markets/ตลาดมอดินแดง-มหาวิทยาลัยขอนแก่น/300884135_602817584652953_9189199073109677491_n.png,https://thaimarket.biz/markets/ตลาดมอดินแดง-มหาวิทยาลัยขอนแก่น
932,ตลาดเช้าบ้านดอนบม,0.00 (0),"เมืองขอนแก่น, ขอนแก่น",,https://dx0z0m6vobblr.cloudfront.net/markets/ตลาดเช้าบ้านดอนบม/2020-01-24.jpg,https://thaimarket.biz/markets/ตลาดเช้าบ้านดอนบม
933,ตลาดนัดเปิดท้าย มข.,"4.50 (1,677)","เมืองขอนแก่น, ขอนแก่น",,https://dx0z0m6vobblr.cloudfront.net/markets/ตลาดนัดเปิดท้าย-มข-/d5be3fbd4dbd46f997a708eb0dbb0422.jpg,https://thaimarket.biz/markets/ตลาดนัดเปิดท้าย-มข-
934,ตลาดริมบึงแก่นนคร,4.50 (759),"เมืองขอนแก่น, ขอนแก่น",,https://dx0z0m6vobblr.cloudfront.net/markets/ตลาดริมบึงแก่นนคร/Screenshot 2024-09-24 172533.png,https://thaimarket.biz/markets/ตลาดริมบึงแก่นนคร
935,ตลาดสดเทศบาล1,4.10 (412),"เมืองขอนแก่น, ขอนแก่น",,https://dx0z0m6vobblr.cloudfront.net/markets/ตลาดสดเทศบาล1/Screenshot 2024-09-24 184124.png,https://thaimarket.biz/markets/ตลาดสดเทศบาล1
936,ตลาดประตูน้ำขอนแก่น,4.30 (570),"เมืองขอนแก่น, ขอนแก่น",,https://dx0z0m6vobblr.cloudfront.net/markets/ตลาดประตูน้ำขอนแก่น/IMG_20180805_140958.jpg,https://thaimarket.biz/markets/ตลาดประตูน้ำขอนแก่น
937,ตลาดบางลำภู,4.30 (834),"เมืองขอนแก่น, ขอนแก่น",,https://dx0z0m6vobblr.cloudfront.net/markets/ตลาดบางลำภู/Screenshot 2024-09-24 183147.png,https://thaimarket.biz/markets/ตลาดบางลำภู
938,ตลาดโต้รุ่งขอนแก่น,"4.50 (1,511)","เมืองขอนแก่น, ขอนแก่น",,https://dx0z0m6vobblr.cloudfront.net/markets/ตลาดโต้รุ่งขอนแก่น/Screenshot 2024-09-24 182008.png,https://thaimarket.biz/markets/ตลาดโต้รุ่งขอนแก่น
939,ตลาดถนนคนเดินขอนแก่น,"4.40 (1,776)","เมืองขอนแก่น, ขอนแก่น",,https://dx0z0m6vobblr.cloudfront.net/markets/ตลาดถนนคนเดินขอนแก่น/Screenshot 2024-09-24 160711.png,https://thaimarket.biz/markets/ตลาดถนนคนเดินขอนแก่น
940,ตลาดต้นตาล,4.70 (317),"เมืองขอนแก่น, ขอนแก่น",,https://dx0z0m6vobblr.cloudfront.net/markets/ตลาดต้นตาล/2024-07-12.jpg,https://thaimarket.biz/markets/ตลาดต้นตาล
941,ตลาดเทศบาลปากดง,4.10 (400),"เมืองขอนแก่น, ขอนแก่น",,https://dx0z0m6vobblr.cloudfront.net/markets/ตลาดเทศบาลปากดง/2019-04-12.jpg,https://thaimarket.biz/markets/ตลาดเทศบาลปากดง
942,ตลาดรุ่งศักดิ์คลองลาน,3.80 (300),"เมืองขอนแก่น, ขอนแก่น",,https://dx0z0m6vobblr.cloudfront.net/markets/ตลาดรุ่งศักดิ์คลองลาน/2018-01-12 (2).jpg,https://thaimarket.biz/markets/ตลาดรุ่งศักดิ์คลองลาน
