MarketId,MarketName,MarketRating,MarketAddress,MarketPrice,UrlImageProfile,LinkDetail
444,AWAKE ตลาดนัดแห่งใหม่ เพื่อคนปทุมธานี,0.00 (0),"เมืองประจวบคีรีขันธ์, ประจวบคีรีขันธ์",,https://dx0z0m6vobblr.cloudfront.net/markets/awake-ตลาดนัดแห่งใหม่-เพื่อคนปทุมธานี/459752578_514760511304041_7418745456961635370_n.jpg,https://thaimarket.biz/markets/awake-ตลาดนัดแห่งใหม่-เพื่อคนปทุมธานี
445,ตลาดนัดแฟคคอม,0.00 (0),"ลาดหลุมแก้ว, ปทุมธานี",,https://dx0z0m6vobblr.cloudfront.net/markets/ตลาดนัดแฟคคอม/2019-11-01.jpg,https://thaimarket.biz/markets/ตลาดนัดแฟคคอม
446,ตลาดนัดอุดมทรัพย์,0.00 (0),"ลาดหลุมแก้ว, ปทุมธานี",,https://dx0z0m6vobblr.cloudfront.net/markets/ตลาดนัดอุดมทรัพย์/217806745_201147868695953_2226116103406747435_n.jpg,https://thaimarket.biz/markets/ตลาดนัดอุดมทรัพย์
447,ตลาดวัดบัวแก้วเกษร,0.00 (0),"ลาดหลุมแก้ว, ปทุมธานี",,https://dx0z0m6vobblr.cloudfront.net/markets/ตลาดวัดบัวแก้วเกษร/2020-02-01.jpg,https://thaimarket.biz/markets/ตลาดวัดบัวแก้วเกษร
448,ตลาดโรงเกลือท้ายเกาะสามโคก,0.00 (0),"ลาดหลุมแก้ว, ปทุมธานี",,https://dx0z0m6vobblr.cloudfront.net/markets/ตลาดโรงเกลือท้ายเกาะสามโคก/Screenshot 2024-10-02 091333.png,https://thaimarket.biz/markets/ตลาดโรงเกลือท้ายเกาะสามโคก
449,ตลาดสดละไม,0.00 (0),"ลาดหลุมแก้ว, ปทุมธานี",,https://dx0z0m6vobblr.cloudfront.net/markets/ตลาดสดละไม/11111.jpg,https://thaimarket.biz/markets/ตลาดสดละไม
450,ตลาดสดบ้านเขย่า (ตลาดแม่น้ำ ซ.7),0.00 (0),"ลาดหลุมแก้ว, ปทุมธานี",,https://dx0z0m6vobblr.cloudfront.net/markets/ตลาดสดบ้านเขย่า-ตลาดแม่น้ำ-ซ-7-/11111.jpg,https://thaimarket.biz/markets/ตลาดสดบ้านเขย่า-ตลาดแม่น้ำ-ซ-7-
451,ตลาดสดนาเจริญสุข,0.00 (0),"ลาดหลุมแก้ว, ปทุมธานี",,https://dx0z0m6vobblr.cloudfront.net/markets/ตลาดสดนาเจริญสุข/5.jpg,https://thaimarket.biz/markets/ตลาดสดนาเจริญสุข
452,ตลาดนัดเมืองแก้ว,0.00 (0),"ลาดหลุมแก้ว, ปทุมธานี",,https://dx0z0m6vobblr.cloudfront.net/markets/ตลาดนัดเมืองแก้ว/1.jpg,https://thaimarket.biz/markets/ตลาดนัดเมืองแก้ว
453,ตลาดสดบ้านท่าเกษม,0.00 (0),"ลาดหลุมแก้ว, ปทุมธานี",,https://dx0z0m6vobblr.cloudfront.net/markets/ตลาดสดบ้านท่าเกษม/1.jpg,https://thaimarket.biz/markets/ตลาดสดบ้านท่าเกษม
454,ตลาดดอกแก้วศาลากลางจังหวัดสระแก้ว,0.00 (0),"ลาดหลุมแก้ว, ปทุมธานี",,https://dx0z0m6vobblr.cloudfront.net/markets/ตลาดดอกแก้วศาลากลางจังหวัดสระแก้ว/3.jpg,https://thaimarket.biz/markets/ตลาดดอกแก้วศาลากลางจังหวัดสระแก้ว
455,ตลาดวัดหลักสี่ราษฎร์สโมสร,0.00 (0),"ลาดหลุมแก้ว, ปทุมธานี",,https://dx0z0m6vobblr.cloudfront.net/markets/ตลาดวัดหลักสี่ราษฎร์สโมสร/5.jpg,https://thaimarket.biz/markets/ตลาดวัดหลักสี่ราษฎร์สโมสร
456,ตลาดน้ำท่าคา,0.00 (0),"ลาดหลุมแก้ว, ปทุมธานี",,https://dx0z0m6vobblr.cloudfront.net/markets/ตลาดน้ำท่าคา/2022-12-17.jpg,https://thaimarket.biz/markets/ตลาดน้ำท่าคา
457,ตลาดสดเทศบาลตำบลบ้านสวน,0.00 (0),"เมืองสุโขทัย, สุโขทัย",,https://dx0z0m6vobblr.cloudfront.net/markets/ตลาดสดเทศบาลตำบลบ้านสวน/2020-01-04.jpg,https://thaimarket.biz/markets/ตลาดสดเทศบาลตำบลบ้านสวน
458,ตลาดโรงพยาบาลบ้านแพ้ว,0.00 (0),"เมืองสุโขทัย, สุโขทัย",,https://dx0z0m6vobblr.cloudfront.net/markets/ตลาดโรงพยาบาลบ้านแพ้ว/1.jpg,https://thaimarket.biz/markets/ตลาดโรงพยาบาลบ้านแพ้ว
459,ตลาดนัดบางโทรัด,0.00 (0),"เมืองสุโขทัย, สุโขทัย",,https://dx0z0m6vobblr.cloudfront.net/markets/ตลาดนัดบางโทรัด/1.jpg,https://thaimarket.biz/markets/ตลาดนัดบางโทรัด
460,ตลาดสดเทศบาลเมืองกระทุ่มแบน,0.00 (0),"เมืองสุโขทัย, สุโขทัย",,https://dx0z0m6vobblr.cloudfront.net/markets/ตลาดสดเทศบาลเมืองกระทุ่มแบน/5.jpg,https://thaimarket.biz/markets/ตลาดสดเทศบาลเมืองกระทุ่มแบน
461,ตลาดหัวดง,0.00 (0),"เมืองสุโขทัย, สุโขทัย",,https://dx0z0m6vobblr.cloudfront.net/markets/ตลาดหัวดง/2.jpg,https://thaimarket.biz/markets/ตลาดหัวดง
462,ตลาดสดวังสีสูบ,0.00 (0),"เมืองสุโขทัย, สุโขทัย",,https://dx0z0m6vobblr.cloudfront.net/markets/ตลาดสดวังสีสูบ/20211029_183115.jpg,https://thaimarket.biz/markets/ตลาดสดวังสีสูบ
463,ตลาดนัดหน้าอบจ.,0.00 (0),"เมืองสุโขทัย, สุโขทัย",,https://dx0z0m6vobblr.cloudfront.net/markets/ตลาดนัดหน้าอบจ-/3.jpg,https://thaimarket.biz/markets/ตลาดนัดหน้าอบจ
464,ตลาดนัดคลองถมสุวรรณคูหา,0.00 (0),"เมืองสุโขทัย, สุโขทัย",,https://dx0z0m6vobblr.cloudfront.net/markets/ตลาดนัดคลองถมสุวรรณคูหา/108153461_131961898551894_580899557756569231_n.jpg,https://thaimarket.biz/markets/ตลาดนัดคลองถมสุวรรณคูหา
465,ตลาดนัดแสงตะวัน,0.00 (0),"เมืองสุโขทัย, สุโขทัย",,https://dx0z0m6vobblr.cloudfront.net/markets/ตลาดนัดแสงตะวัน/2.jpg,https://thaimarket.biz/markets/ตลาดนัดแสงตะวัน
466,ตลาดหน้าคลองสวนร้อยปี,0.00 (0),"เมืองสุโขทัย, สุโขทัย",,https://dx0z0m6vobblr.cloudfront.net/markets/ตลาดหน้าคลองสวนร้อยปี/6.jpg,https://thaimarket.biz/markets/ตลาดหน้าคลองสวนร้อยปี
467,ตลาดน้ำเรือบิน,0.00 (0),"เมืองสุโขทัย, สุโขทัย",,https://dx0z0m6vobblr.cloudfront.net/markets/ตลาดน้ำเรือบิน/2.jpg,https://thaimarket.biz/markets/ตลาดน้ำเรือบิน
468,ตลาดโชคอำนวยพลาซ่า,0.00 (0),"เมืองสุโขทัย, สุโขทัย",,https://dx0z0m6vobblr.cloudfront.net/markets/ตลาดโชคอำนวยพลาซ่า-2/4.jpg,https://thaimarket.biz/markets/ตลาดโชคอำนวยพลาซ่า-2
469,ตลาดบางโฉลง,0.00 (0),"บางพลี, สมุทรปราการ",,https://dx0z0m6vobblr.cloudfront.net/markets/ตลาดบางโฉลง/6.jpg,https://thaimarket.biz/markets/ตลาดบางโฉลง
470,ตลาดทวีผล,0.00 (0),"บางพลี, สมุทรปราการ",,https://dx0z0m6vobblr.cloudfront.net/markets/ตลาดทวีผล/1.jpg,https://thaimarket.biz/markets/ตลาดทวีผล
471,ตลาดนัดพูลเจริญ,3.90 (79),"บางพลี, สมุทรปราการ",,https://dx0z0m6vobblr.cloudfront.net/markets/ตลาดนัดพูลเจริญ/2.jpg,https://thaimarket.biz/markets/ตลาดนัดพูลเจริญ
472,ตลาดต้องชมสถานีรถไฟกันตัง,4.80 (232),"บางพลี, สมุทรปราการ",,https://dx0z0m6vobblr.cloudfront.net/markets/ตลาดต้องชมสถานีรถไฟกันตัง/565565656666565.png,https://thaimarket.biz/markets/ตลาดต้องชมสถานีรถไฟกันตัง
473,ตลาดเปิดท้ายนานิน,4.30 (8),"บางพลี, สมุทรปราการ",,https://dx0z0m6vobblr.cloudfront.net/markets/ตลาดเปิดท้ายนานิน/020202 - Copy.png,https://thaimarket.biz/markets/ตลาดเปิดท้ายนานิน
474,ตลาดเทศาบาลนาเมืองเพชร,4.80 (6),"บางพลี, สมุทรปราการ",,https://dx0z0m6vobblr.cloudfront.net/markets/ตลาดเทศาบาลนาเมืองเพชร/020202 - Copy.png,https://thaimarket.biz/markets/ตลาดเทศาบาลนาเมืองเพชร
475,ตลาดสดเทศบาลตำบลบ่อพลอย,4.00 (155),"บางพลี, สมุทรปราการ",,https://dx0z0m6vobblr.cloudfront.net/markets/ตลาดสดเทศบาลตำบลบ่อพลอย/000 - Copy.png,https://thaimarket.biz/markets/ตลาดสดเทศบาลตำบลบ่อพลอย
476,ตลาดสดเทศบาลตำบลคลองใหญ่,4.00 (385),"บางพลี, สมุทรปราการ",,https://dx0z0m6vobblr.cloudfront.net/markets/ตลาดสดเทศบาลตำบลคลองใหญ่/000 - Copy.png,https://thaimarket.biz/markets/ตลาดสดเทศบาลตำบลคลองใหญ่
477,ตลาดหน้า ร.ร.สตรีประเสริฐศิลป์ (ตลาดนัดโกดัง),4.30 (32),"บางพลี, สมุทรปราการ",,https://dx0z0m6vobblr.cloudfront.net/markets/ตลาดหน้า-ร-ร-สตรีประเสริฐศิลป์-ตลาดนัดโกดัง-/000 - Copy.png,https://thaimarket.biz/markets/ตลาดหน้า-ร-ร-สตรีประเสริฐศิลป์-ตลาดนัดโกดัง-
478,ตลาดสดวังเจ้า,4.20 (5),"บางพลี, สมุทรปราการ",,https://dx0z0m6vobblr.cloudfront.net/markets/ตลาดสดวังเจ้า/000 - Copy.png,https://thaimarket.biz/markets/ตลาดสดวังเจ้า
479,ตลาดสดเทศบาลตำบลอุ้มผาง,4.80 (29),"บางพลี, สมุทรปราการ",,https://dx0z0m6vobblr.cloudfront.net/markets/ตลาดสดเทศบาลตำบลอุ้มผาง/000 - Copy.png,https://thaimarket.biz/markets/ตลาดสดเทศบาลตำบลอุ้มผาง
480,ตลาดต้องชมไม้ดอกไม้ประดับ คลอง 15,4.60 (5),"บางพลี, สมุทรปราการ",,https://dx0z0m6vobblr.cloudfront.net/markets/ตลาดต้องชมไม้ดอกไม้ประดับ-คลอง-15/000 - Copy.png,https://thaimarket.biz/markets/ตลาดต้องชมไม้ดอกไม้ประดับ-คลอง-15
481,ตลาดนัดบ้านพริก,4.30 (38),"บ้านนา, นครนายก",,https://dx0z0m6vobblr.cloudfront.net/markets/ตลาดนัดบ้านพริก/0606.png,https://thaimarket.biz/markets/ตลาดนัดบ้านพริก
482,ตลาดสดเกียรติปรุง,4.20 (346),"บ้านนา, นครนายก",,https://dx0z0m6vobblr.cloudfront.net/markets/ตลาดสดเกียรติปรุง/000 - Copy.png,https://thaimarket.biz/markets/ตลาดสดเกียรติปรุง
483,ตลาดนัด ม.ศ.ว.,5.00 (4),"บ้านนา, นครนายก",,https://dx0z0m6vobblr.cloudfront.net/markets/ตลาดนัด-ม-ศ-ว-/020202 - Copy.png,https://thaimarket.biz/markets/ตลาดนัด-ม-ศ-ว-
484,ตลาดนัดวัดสมอ,4.20 (55),"บ้านนา, นครนายก",,https://dx0z0m6vobblr.cloudfront.net/markets/ตลาดนัดวัดสมอ/0606.png,https://thaimarket.biz/markets/ตลาดนัดวัดสมอ
485,ตลาดนัดหน้าอำเภอองครักษ์,4.10 (8),"บ้านนา, นครนายก",,https://dx0z0m6vobblr.cloudfront.net/markets/ตลาดนัดหน้าอำเภอองครักษ์/020202 - Copy.png,https://thaimarket.biz/markets/ตลาดนัดหน้าอำเภอองครักษ์
486,ตลาดสดวัดตระพังทองเมืองเก่า,4.40 (143),"บ้านนา, นครนายก",,https://dx0z0m6vobblr.cloudfront.net/markets/ตลาดสดวัดตระพังทองเมืองเก่า/2022-05-04.jpg,https://thaimarket.biz/markets/ตลาดสดวัดตระพังทองเมืองเก่า
487,ตลาดโพธิ์พระยา,4.40 (72),"บ้านนา, นครนายก",,https://dx0z0m6vobblr.cloudfront.net/markets/ตลาดโพธิ์พระยา/2023-12-15 (2).jpg,https://thaimarket.biz/markets/ตลาดโพธิ์พระยา
488,ตลาดโตโลโปตี้,4.30 (189),"บ้านนา, นครนายก",,https://dx0z0m6vobblr.cloudfront.net/markets/ตลาดโตโลโปตี้/2022-03-12.jpg,https://thaimarket.biz/markets/ตลาดโตโลโปตี้
489,ตลาดสดเทศลาลตำบลทุ่งยาว,0.00 (0),"บ้านนา, นครนายก",,https://dx0z0m6vobblr.cloudfront.net/markets/ตลาดสดเทศลาลตำบลทุ่งยาว/2023-10-21.jpg,https://thaimarket.biz/markets/ตลาดสดเทศลาลตำบลทุ่งยาว
490,ตลาดสีมงคล,4.30 (330),"บ้านนา, นครนายก",,https://dx0z0m6vobblr.cloudfront.net/markets/ตลาดสีมงคล/20190421_093953.jpg,https://thaimarket.biz/markets/ตลาดสีมงคล
491,ตลาดต้องชม นาปด,4.10 (19),"บ้านนา, นครนายก",,https://dx0z0m6vobblr.cloudfront.net/markets/ตลาดต้องชม-นาปด/305311119_523425296254588_3917920739506944452_n.jpg,https://thaimarket.biz/markets/ตลาดต้องชม-นาปด
492,ตลาดสดเทศบาลตำบลทุ่งยาว,0.00 (0),"บ้านนา, นครนายก",,-,https://thaimarket.biz/markets/ตลาดสดเทศบาลตำบลทุ่งยาว
493,ตลาดสดเทศบาลอำเภอคอนสวรรค์ (ร้านอู๋ไก่สด),4.30 (17),"คอนสวรรค์, ชัยภูมิ",,https://dx0z0m6vobblr.cloudfront.net/markets/ตลาดสดเทศบาลอำเภอคอนสวรรค์-ร้านอู๋ไก่สด-/2018-05-19.jpg,https://thaimarket.biz/markets/ตลาดสดเทศบาลอำเภอคอนสวรรค์-ร้านอู๋ไก่สด-
494,ตลาดสดเทศบาลสุวรรณคูหา,4.00 (187),"คอนสวรรค์, ชัยภูมิ",,https://dx0z0m6vobblr.cloudfront.net/markets/ตลาดสดเทศบาลสุวรรณคูหา/IMG_20230318_175013.jpg,https://thaimarket.biz/markets/ตลาดสดเทศบาลสุวรรณคูหา
495,ตลาดนัดคลองถมกุดแห่,0.00 (0),"คอนสวรรค์, ชัยภูมิ",,https://dx0z0m6vobblr.cloudfront.net/markets/ตลาดนัดคลองถมกุดแห่/121809714_165816498499767_6828581985359346855_n.jpg,https://thaimarket.biz/markets/ตลาดนัดคลองถมกุดแห่
496,ตลาดนัดคลองถมสี่แยกไฟแดงอำเภอศรีบุญเรือง,4.20 (5),"คอนสวรรค์, ชัยภูมิ",,https://dx0z0m6vobblr.cloudfront.net/markets/ตลาดนัดคลองถมสี่แยกไฟแดงอำเภอศรีบุญเรือง/2021-06-03.jpg,https://thaimarket.biz/markets/ตลาดนัดคลองถมสี่แยกไฟแดงอำเภอศรีบุญเรือง
497,ตลาดชุมชน ถนนคนเดิน ถมหมืดถมมอ,4.40 (340),"คอนสวรรค์, ชัยภูมิ",,https://dx0z0m6vobblr.cloudfront.net/markets/ตลาดชุมชน-ถนนคนเดิน-ถมหมืดถมมอ/2023-12-09.jpg,https://thaimarket.biz/markets/ตลาดชุมชน-ถนนคนเดิน-ถมหมืดถมมอ
498,ตลาดสดหนองกี่,4.00 (343),"คอนสวรรค์, ชัยภูมิ",,https://dx0z0m6vobblr.cloudfront.net/markets/ตลาดสดหนองกี่/2020-02-19.jpg,https://thaimarket.biz/markets/ตลาดสดหนองกี่
499,ตลาดสดบ้านใหม่ไชยพจน์,4.00 (140),"คอนสวรรค์, ชัยภูมิ",,https://dx0z0m6vobblr.cloudfront.net/markets/ตลาดสดบ้านใหม่ไชยพจน์/25601014-IMG_4607.jpg,https://thaimarket.biz/markets/ตลาดสดบ้านใหม่ไชยพจน์
500,ตลาดเทศบาลพุทไธสง,2.00 (1),"คอนสวรรค์, ชัยภูมิ",,https://dx0z0m6vobblr.cloudfront.net/markets/ตลาดเทศบาลพุทไธสง/Screenshot 2024-10-01 205323.png,https://thaimarket.biz/markets/ตลาดเทศบาลพุทไธสง
501,ตลาดสดเทศบาลนาโพธิ์,4.30 (163),"คอนสวรรค์, ชัยภูมิ",,https://dx0z0m6vobblr.cloudfront.net/markets/ตลาดสดเทศบาลนาโพธิ์/2017-12-12.jpg,https://thaimarket.biz/markets/ตลาดสดเทศบาลนาโพธิ์
502,ตลาดแฮปปี้ไลท์ เลขที่ 150/93,3.80 (55),"คอนสวรรค์, ชัยภูมิ",,https://dx0z0m6vobblr.cloudfront.net/markets/ตลาดแฮปปี้ไลท์-เลขที่-150-93/457553423_1923727314812364_1738473147753679675_n.jpg,https://thaimarket.biz/markets/ตลาดแฮปปี้ไลท์-เลขที่-150-93
503,ตลาดประชารัฐอำเภอบ้านด่าน ที่อยู่ 127 ม.4,4.60 (93),"คอนสวรรค์, ชัยภูมิ",,https://dx0z0m6vobblr.cloudfront.net/markets/ตลาดประชารัฐอำเภอบ้านด่าน-ที่อยู่-127-ม-4/271042160_455568132795229_3321016717339803907_n.jpg,https://thaimarket.biz/markets/ตลาดประชารัฐอำเภอบ้านด่าน-ที่อยู่-127-ม-4
504,ตลาดสายหยุด (ตลาดชุมชนศรีพนา) ตั้งอยู่ในตัวชุมชนตำบลศรีพนา,4.30 (213),"คอนสวรรค์, ชัยภูมิ",,https://dx0z0m6vobblr.cloudfront.net/markets/ตลาดสายหยุด-ตลาดชุมชนศรีพนา-ตั้งอยู่ในตัวชุมชนตำบลศรีพนา/2020-03-01.jpg,https://thaimarket.biz/markets/ตลาดสายหยุด-ตลาดชุมชนศรีพนา-ตั้งอยู่ในตัวชุมชนตำบลศรีพนา
505,ตลาดสดเทศบาลบุ่งคล้า,4.80 (13),"บุ่งคล้า, บึงกาฬ",,https://dx0z0m6vobblr.cloudfront.net/markets/ตลาดสดเทศบาลบุ่งคล้า/Screenshot 2024-10-01 193211.png,https://thaimarket.biz/markets/ตลาดสดเทศบาลบุ่งคล้า
506,ตลาดสดเทศบาลบึงโขงหลง,4.20 (265),"บุ่งคล้า, บึงกาฬ",,https://dx0z0m6vobblr.cloudfront.net/markets/ตลาดสดเทศบาลบึงโขงหลง/2020-06-17.jpg,https://thaimarket.biz/markets/ตลาดสดเทศบาลบึงโขงหลง
507,ตลาดนัดบึงโขงหลง อยู่หน้าตลาดสดเทศบาลบึงโขงหลง,0.00 (0),"บุ่งคล้า, บึงกาฬ",,https://dx0z0m6vobblr.cloudfront.net/markets/ตลาดนัดบึงโขงหลง-อยู่หน้าตลาดสดเทศบาลบึงโขงหลง/2023-03-221.jpg,https://thaimarket.biz/markets/ตลาดนัดบึงโขงหลง-อยู่หน้าตลาดสดเทศบาลบึงโขงหลง
508,ตลาดนัด ไทย  ลาว บึงกาฬ ใกล้กับ บริเวณ สวนสาธารณะบึงกาฬ,0.00 (0),"บุ่งคล้า, บึงกาฬ",,https://dx0z0m6vobblr.cloudfront.net/markets/ตลาดนัด-ไทย-ลาว-บึงกาฬ-ใกล้กับ-บริเวณ-สวนสาธารณะบึงกาฬ/2021-06-14.jpg,https://thaimarket.biz/markets/ตลาดนัด-ไทย-ลาว-บึงกาฬ-ใกล้กับ-บริเวณ-สวนสาธารณะบึงกาฬ
509,ถนนคนเดินข้าวเม่า ลานริมโขง,4.40 (243),"บุ่งคล้า, บึงกาฬ",,https://dx0z0m6vobblr.cloudfront.net/markets/ถนนคนเดินข้าวเม่า-ลานริมโขง/à¸à¸à¸à¸ªà¸²à¸¢à¸§à¸±à¸à¸à¸à¸£à¸£à¸¡01-1024x576.jpg,https://thaimarket.biz/markets/ถนนคนเดินข้าวเม่า-ลานริมโขง
510,ตลาดสดเทศบาลเมืองบึงกาฬ,3.90 (592),"บุ่งคล้า, บึงกาฬ",,https://dx0z0m6vobblr.cloudfront.net/markets/ตลาดสดเทศบาลเมืองบึงกาฬ/2022-03-231.jpg,https://thaimarket.biz/markets/ตลาดสดเทศบาลเมืองบึงกาฬ
511,ตลาดต้องชมเตียวกาดแลงเมืองปัว,4.40 (259),"บุ่งคล้า, บึงกาฬ",,https://dx0z0m6vobblr.cloudfront.net/markets/ตลาดต้องชมเตียวกาดแลงเมืองปัว/20221105_174043.jpg,https://thaimarket.biz/markets/ตลาดต้องชมเตียวกาดแลงเมืองปัว
512,ตลาดสดเทศบาลตำบลและ อำเภอทุ่งช้าง,4.10 (92),"บุ่งคล้า, บึงกาฬ",,https://dx0z0m6vobblr.cloudfront.net/markets/ตลาดสดเทศบาลตำบลและ-อำเภอทุ่งช้าง/2023-12-27.jpg,https://thaimarket.biz/markets/ตลาดสดเทศบาลตำบลและ-อำเภอทุ่งช้าง
513,ตลาดสดเทศบาลอำเภอเชียงกลาง อำเภอเชียงกลาง,4.20 (277),"บุ่งคล้า, บึงกาฬ",,https://dx0z0m6vobblr.cloudfront.net/markets/ตลาดสดเทศบาลอำเภอเชียงกลาง-อำเภอเชียงกลาง/2018-01-01.jpg,https://thaimarket.biz/markets/ตลาดสดเทศบาลอำเภอเชียงกลาง-อำเภอเชียงกลาง
