MarketId,MarketName,MarketRating,MarketAddress,MarketPrice,UrlImageProfile,LinkDetail
1,ตลาดบางแคภิรมย์,4.10 (254),"บางแค, กรุงเทพมหานคร",500,https://dx0z0m6vobblr.cloudfront.net/market/image/image_65f93d5efafeb5ff589d0fc4_3ca600f9_0a40_4ffd_bcd5_6b3960c59540.jpg,https://thaimarket.biz/markets/ตลาดบางแคภิรมย์
2,ตลาดธนบุรี (สนามหลวง 2),"4.20 (8,118)","บางแค, กรุงเทพมหานคร",800,https://dx0z0m6vobblr.cloudfront.net/market/image/image_65f94d91fafeb5ff589d11df_286fca95_228e_4d4f_af60_d3f0d31fbe51.jpg,https://thaimarket.biz/markets/ตลาดธนบุรี-สนามหลวง-2-
3,ตลาดสมบัติบุรี,"4.40 (2,617)","บางแค, กรุงเทพมหานคร",150,https://dx0z0m6vobblr.cloudfront.net/market/image/image_646ddf49a2361d4859dfba5d_c0220570_fc02_4aa0_9e3b_2f8bd9e27bb7.jpg,https://thaimarket.biz/markets/ตลาดสมบัติบุรี
4,ตลาดนัดมีนบุรี (จตุจักร 2),"4.10 (2,087)","บางแค, กรุงเทพมหานคร",550,https://dx0z0m6vobblr.cloudfront.net/market/image/image_65f94d41fafeb5ff589d11cf_e96d5797_19f5_405b_b96b_93d99bf107fa.jpg,https://thaimarket.biz/markets/ตลาดนัดมีนบุรี-จตุจักร-2-
5,ตลาดนำชัยแฟร์  Numchai fair,4.70 (6),"บางแค, กรุงเทพมหานคร",6300,https://dx0z0m6vobblr.cloudfront.net/market/image/image_65126d4b8a56f60b3dd4a7b2_cf16ee3e_af16_45a3_8296_37d151d192bf.jpg,https://thaimarket.biz/markets/ตลาดนำชัยแฟร์-numchai-fair
6,ตลาดกลางปลาสวยงามและสัตว์เลี้ยง (ฟิช วิลเลจ),4.40 (970),"บางแค, กรุงเทพมหานคร",2500,https://dx0z0m6vobblr.cloudfront.net/markets/ตลาดกลางปลาสวยงามและสัตว์เลี้ยง-ฟิช-วิลเลจ-/347790451_699908902142896_5401094002903865854_n.jpg,https://thaimarket.biz/markets/ตลาดกลางปลาสวยงามและสัตว์เลี้ยง-ฟิช-วิลเลจ-
7,ตลาดรุ่งโรจน์ คลอง 4,4.40 (312),"บางแค, กรุงเทพมหานคร",2000,https://dx0z0m6vobblr.cloudfront.net/market/image/image_650aa1e54b673e0ad23d9c43_816ef159_4df1_4fa7_8346_69b6008c60a6.jpg,https://thaimarket.biz/markets/ตลาดรุ่งโรจน์-คลอง4
8,ตลาดรังสิต,"4.20 (7,094)","บางแค, กรุงเทพมหานคร",90,https://dx0z0m6vobblr.cloudfront.net/market/image/image_65f119582155dbc4ce9f98dd_3f1f8c22_df0e_460a_b0a5_6c5892bc1d62.jpg,https://thaimarket.biz/markets/ตลาดรังสิต
9,ตลาดล้านเมือง ล้านเมืองไนท์มาร์เก็ต,4.40 (307),"บางแค, กรุงเทพมหานคร",200,https://dx0z0m6vobblr.cloudfront.net/markets/ตลาดล้านเมือง-ล้านเมืองไนท์มาร์เก็ต/291332784_5107103992672168_2366698144889962194_n.jpg,https://thaimarket.biz/markets/ตลาดล้านเมือง-ล้านเมืองไนท์มาร์เก็ต
10,ตลาดก้ามปู พัฒนาการ 20,4.10 (190),"บางแค, กรุงเทพมหานคร",2500,https://dx0z0m6vobblr.cloudfront.net/market/image/image_64800829f24e090cf0b467a0_3e2628a5_935e_40f9_b99c_3e1e0da3ba63.jpg,https://thaimarket.biz/markets/ตลาดก้ามปู-พัฒนาการ-20
11,ตลาดเยสบางพลี YesBangphli,4.20 (774),"บางแค, กรุงเทพมหานคร",2000,https://dx0z0m6vobblr.cloudfront.net/markets/ตลาดเยสบางพลี YesBangphli/385336_0.jpg,https://thaimarket.biz/markets/ตลาดเยสบางพลี YesBangphli
12,ตลาดกิเลน,"4.40 (1,201)","บางแค, กรุงเทพมหานคร",20,https://dx0z0m6vobblr.cloudfront.net/image_6467dbfbb031d2ce0da53b37_1694086604294.jpg,https://thaimarket.biz/markets/ตลาดกิเลน
13,ตลาดโต้รุ่งไนท์มาเก็ตเพชรบุรี,5.00 (1),"เมืองเพชรบุรี, เพชรบุรี",120,https://dx0z0m6vobblr.cloudfront.net/market/image/image_6629db0a2bab64bf28b0905a_d20164bc_0254_4b19_8e85_48ecb3320293.jpg,https://thaimarket.biz/markets/ตลาดโต้รุ่งไนท์มาเก็ตเพชรบุรี
14,ตลาดอมร (ปากซอยแอนเน็กซ์ พหลโยธิน58),"4.00 (1,045)","เมืองเพชรบุรี, เพชรบุรี",3000,https://dx0z0m6vobblr.cloudfront.net/markets/ตลาดอมร-ปากซอยแอนเน็กซ์พหลโยธิน58/487779.jpg,https://thaimarket.biz/markets/ตลาดอมร-ปากซอยแอนเน็กซ์พหลโยธิน58
15,ตลาดสดสมบูรณ์อ้อมน้อย,3.90 (135),"เมืองเพชรบุรี, เพชรบุรี",6000,https://dx0z0m6vobblr.cloudfront.net/image_64f59f4343f5a87ae476a7e0_1693903896197.jpg,https://thaimarket.biz/markets/ตลาดสดสมบูรณ์อ้อมน้อย
16,ตลาดเสนีย์ฟู้ด,4.20 (530),"เมืองเพชรบุรี, เพชรบุรี",200,https://dx0z0m6vobblr.cloudfront.net/markets/ตลาดเสนีย์ฟู้ด/à¸à¸à¸à¸¥à¸²à¸à¹à¸ªà¸à¸µà¸¢à¹à¸à¸¹à¹à¸-23 (1)22.jpg,https://thaimarket.biz/markets/ตลาดเสนีย์ฟู้ด
17,Sila Market ตลาดศิลามาร์เก็ต,4.30 (114),"เมืองเพชรบุรี, เพชรบุรี",4500,https://dx0z0m6vobblr.cloudfront.net/markets/sila-market-ตลาดศิลามาร์เก็ต/LINE_ALBUM__4 à¸à¸¥à¸²à¸à¸¨à¸´à¸¥à¸²à¸¡à¸²à¸£à¹à¹à¸à¹à¸ à¹à¸¢à¸µà¹à¸¢à¸¡à¸à¸¡_240815_1.jpg,https://thaimarket.biz/markets/sila-market-ตลาดศิลามาร์เก็ต
18,ตลาดหงษ์แก้ว,4.20 (151),"เมืองเพชรบุรี, เพชรบุรี",100,https://dx0z0m6vobblr.cloudfront.net/market/image/image_657fbe2c85978dbd0e17daef_7d2564cb_2121_4dd6_b36c_0b58da06c832.png,https://thaimarket.biz/markets/ตลาดหงษ์แก้ว
19,ตลาดธันยา,"4.40 (1,804)","เมืองเพชรบุรี, เพชรบุรี",120,https://dx0z0m6vobblr.cloudfront.net/image_6467d53ab031d2ce0da53b11_1694605447363.jpg,https://thaimarket.biz/markets/ตลาดธันยา
20,บ้านปทุมมาร์เก็ต,4.40 (17),"เมืองเพชรบุรี, เพชรบุรี",1500,https://dx0z0m6vobblr.cloudfront.net/market/image/image_660a2a9d13d9b233dfdcbc01_2b730b65_4d7b_46af_88b3_500beea07d02.jpg,https://thaimarket.biz/markets/บ้านปทุมมาร์เก็ต
21,สตาร์ไนท์บาซ่าร์ ระยอง,"4.20 (2,818)","เมืองเพชรบุรี, เพชรบุรี",4700,https://dx0z0m6vobblr.cloudfront.net/image_646c6289a2361d4859dfb5b2_1684824821335.jpg,https://thaimarket.biz/markets/สตาร์ไนท์บาซ่าร์ ระยอง
22,ลองมาซิเออ ไนท์มาร์เก็ต,0.00 (0),"เมืองเพชรบุรี, เพชรบุรี",150,https://dx0z0m6vobblr.cloudfront.net/market/image/image_6538a0d286a3620a6d6277c0_a9f6c31b_be84_4fed_bc0e_f194914df942.jpg,https://thaimarket.biz/markets/ลองมาซิเออ-ไนท์มาร์เก็ต
23,ตลาดกระดิ่งทอง มหาชัย,4.40 (27),"เมืองเพชรบุรี, เพชรบุรี",80,https://dx0z0m6vobblr.cloudfront.net/market/image/image_65fbfb626cdbfd4bf4c36156_b924c8cb_1f1d_4419_a564_2c5cb3752d61.jpg,https://thaimarket.biz/markets/ตลาดกระดิ่งทอง-มหาชัย
24,ตลาดใจFull Market นครนายก,4.70 (3),"เมืองเพชรบุรี, เพชรบุรี",200,https://dx0z0m6vobblr.cloudfront.net/market/image/image_659509d0ac52740ecca7b8d1_508d8879_5ad1_4602_884d_f07f93f9f39e.jpg,https://thaimarket.biz/markets/ตลาดใจfull-market-นครนายก
25,ตลาดกลางผักและผลไม้จังหวัดราชบุรี (ตลาดศรีเมือง),"4.30 (2,709)","เมืองราชบุรี, ราชบุรี",435,https://dx0z0m6vobblr.cloudfront.net/markets/ตลาดกลางผักและผลไม้จังหวัดราชบุรี-ตลาดศรีเมือง-/326708201_1235830417004353_7265493128815574032_n.jpg,https://thaimarket.biz/markets/ตลาดกลางผักและผลไม้จังหวัดราชบุรี-ตลาดศรีเมือง-
26,ตลาดอ่อนนุช โซนเหนือ,"4.20 (1,266)","เมืองราชบุรี, ราชบุรี",4804.42,https://dx0z0m6vobblr.cloudfront.net/markets/ตลาดอ่อนนุช-โซนเหนือ/385113_0.jpg,https://thaimarket.biz/markets/ตลาดอ่อนนุช-โซนเหนือ
27,ตลาดแม่อุทัย,4.30 (151),"เมืองราชบุรี, ราชบุรี",80,https://dx0z0m6vobblr.cloudfront.net/image_647562f3f24e090cf0b459f2_1685416219125.jpeg,https://thaimarket.biz/markets/ตลาดแม่อุทัย
28,ตลาดรวยมาร์เก็ต ประชาอุทิศ 90,4.20 (421),"เมืองราชบุรี, ราชบุรี",150,https://dx0z0m6vobblr.cloudfront.net/markets/รวยมาร์เก็ต-ประชาอุทิศ-90/325394185_1579269769258001_7922118441248986186_n.jpg,https://thaimarket.biz/markets/ตลาดรวยมาร์เก็ต
29,THE 27 AVENUE,5.00 (1),"เมืองราชบุรี, ราชบุรี",1000,https://dx0z0m6vobblr.cloudfront.net/markets/the-27-avenue/436351165_1161495205220774_6024227316097890567_n - Apinya Noppakun.jpg,https://thaimarket.biz/markets/the-27-avenue
30,ฟู้ดดี้ฟาร์ม บางใหญ่,4.30 (367),"เมืองราชบุรี, ราชบุรี",4000,https://dx0z0m6vobblr.cloudfront.net/markets/ฟู้ดดี้ฟาร์ม-บางใหญ่/82e3f8d666e244989b9d64224a12aabc.jpg,https://thaimarket.biz/markets/ฟู้ดดี้ฟาร์ม-บางใหญ่
31,ตลาดนัดเพิ่มพูนทรัพย์ สาขา 5,4.90 (8),"เมืองราชบุรี, ราชบุรี",140,https://dx0z0m6vobblr.cloudfront.net/markets/ตลาดนัดเพิ่มพูนทรัพย์-สาขา-5/12404E2B-DFEF-4780-9ECB-61B23D0728F2.jpeg,https://thaimarket.biz/markets/ตลาดนัดเพิ่มพูนทรัพย์-สาขา-5
32,ตลาดเพิ่มพูนทรัพย์ สาขา 2,4.30 (4),"เมืองราชบุรี, ราชบุรี",2500,https://dx0z0m6vobblr.cloudfront.net/markets/ตลาดเพิ่มพูนทรัพย์-สาขา-2/1721036912273.jpg,https://thaimarket.biz/markets/ตลาดเพิ่มพูนทรัพย์-สาขา-2
33,ตลาดมหาดไทย 3,5.00 (2),"เมืองราชบุรี, ราชบุรี",600,https://dx0z0m6vobblr.cloudfront.net/markets/ตลาดมหาดไทย-3/5656.jpg,https://thaimarket.biz/markets/ตลาดมหาดไทย-3
34,ตลาดร้อยปี เลเจนด์สยาม พัทยา,"4.20 (1,896)","เมืองราชบุรี, ราชบุรี",3000,https://dx0z0m6vobblr.cloudfront.net/markets/ตลาดร้อยปี-เลเจนด์สยาม-พัทยา/332959417_731992054969432_262958447106886374_n.jpg,https://thaimarket.biz/markets/ตลาดร้อยปี-เลเจนด์สยาม-พัทยา
35,ยิ่งเจริญ สแควร์,4.30 (154),"เมืองราชบุรี, ราชบุรี",19000,https://dx0z0m6vobblr.cloudfront.net/image_64db4048dfdbcafc80f1eec5_1694067662056.jpg,https://thaimarket.biz/markets/ยิ่งเจริญ-สแควร์
36,ตลาดนัดประชาอุทิศ ​90,4.40 (161),"เมืองราชบุรี, ราชบุรี",80,https://dx0z0m6vobblr.cloudfront.net/markets/ตลาดนัดประชาอุทิศ-90/445174444_473566535245672_5226361487570639389_n.jpg,https://thaimarket.biz/markets/ตลาดนัดประชาอุทิศ-90
37,อนามัย พาร์ค  Anamai Park,4.40 (7),"เมืองนนทบุรี, นนทบุรี",100,https://dx0z0m6vobblr.cloudfront.net/market/image/image_65c44873772fd63cfc43754b_714c8229_a2de_4495_bad0_336b998eb55d.jpg,https://thaimarket.biz/markets/อนามัย-พาร์ค-anamai-park
38,ตลาดสี่ตะวัน,4.20 (30),"เมืองนนทบุรี, นนทบุรี",2500,https://dx0z0m6vobblr.cloudfront.net/markets/ตลาดสี่ตะวัน/S__43098116 - DODEE TOURChanel.jpg,https://thaimarket.biz/markets/ตลาดสี่ตะวัน
39,ตลาดสิงหา,5.00 (1),"เมืองนนทบุรี, นนทบุรี",1340,https://dx0z0m6vobblr.cloudfront.net/market/image/image_65f93ec7fafeb5ff589d1009_7869c03c_32df_4da8_9a12_2ca30cdd66cb.jpg,https://thaimarket.biz/markets/ตลาดสิงหา
40,ตลาดนายใหญ่,4.30 (507),"เมืองนนทบุรี, นนทบุรี",150,https://dx0z0m6vobblr.cloudfront.net/image_64db41d9dfdbcafc80f1eed8_1692096827561.jpg,https://thaimarket.biz/markets/ตลาดนายใหญ่
41,ตลาดคูคต สเตชั่น,4.90 (232),"เมืองนนทบุรี, นนทบุรี",4000,https://dx0z0m6vobblr.cloudfront.net/markets/ตลาดคูคต-สเตชั่น/Logo.jpg,https://thaimarket.biz/markets/ตลาดคูคต-สเตชั่น
42,ตลาดนัดยาสูบ TOAT​ FOOD MARKET,0.00 (0),"เมืองนนทบุรี, นนทบุรี",300,https://dx0z0m6vobblr.cloudfront.net/market/image/image_661f59992bab64bf28aeb61f_e6f873f6_67c7_4568_b6dc_4546b8afdb20.jpg,https://thaimarket.biz/markets/ตลาดนัดยาสูบ-toat-food-market
43,ตลาดก้านเหลือง,4.10 (372),"เมืองนนทบุรี, นนทบุรี",100,https://dx0z0m6vobblr.cloudfront.net/markets/ตลาดก้านเหลือง/327146826_482960117161632_6518777198714534935_n.jpg,https://thaimarket.biz/markets/ตลาดก้านเหลือง
44,ตลาดศูนย์การค้ามีนบุรี,4.50 (19),"เมืองนนทบุรี, นนทบุรี",5000,https://dx0z0m6vobblr.cloudfront.net/market/image/image_6507f92a4b673e0ad23d44ef_eab23ac0_de5a_49b3_a7e9_4af1142079bf.jpg,https://thaimarket.biz/markets/ตลาดศูนย์การค้ามีนบุรี
45,ตลาดเดอะวอล์ค พานทอง,4.10 (679),"เมืองนนทบุรี, นนทบุรี",160,https://dx0z0m6vobblr.cloudfront.net/image_646744d9b031d2ce0da53a45_1684491446342.jpg,https://thaimarket.biz/markets/ตลาดเดอะวอล์ค-พานทอง
46,ตลาดนัดจตุจักร,"4.40 (48,045)","เมืองนนทบุรี, นนทบุรี",2300,https://dx0z0m6vobblr.cloudfront.net/market/image/image_65f94de3fafeb5ff589d11e9_ebb24458_8775_4ad0_b2fa_1c386f197133.jpg,https://thaimarket.biz/markets/ตลาดนัดจตุจักร
47,ตลาดประชานิเวศน์ 1,"4.10 (2,256)","เมืองนนทบุรี, นนทบุรี",1385,https://dx0z0m6vobblr.cloudfront.net/market/image/image_65f94c3efafeb5ff589d1180_c2288215_24e0_4ba2_8762_06202befbc8d.jpg,https://thaimarket.biz/markets/ตลาดประชานิเวศน์-1
48,ตลาดนครหลวง,3.90 (459),"เมืองนนทบุรี, นนทบุรี",4000,https://dx0z0m6vobblr.cloudfront.net/image_6467d989b031d2ce0da53b2d_1684583775689.jpg,https://thaimarket.biz/markets/ตลาดนครหลวง
49,ตลาดเจวา มาร์เก็ต  JVaMarket,3.80 (45),"บางใหญ่, นนทบุรี",12000,https://dx0z0m6vobblr.cloudfront.net/market/image/image_659768af81c46e86f41f4dd0_5627cb0d_4a69_42d2_b3ba_77ba49b843fc.jpg,https://thaimarket.biz/markets/ตลาดเจวา-มาร์เก็ต-j-vamarket
50,ตลาดเดินเล่นเพชรเกษม 81,4.00 (69),"บางใหญ่, นนทบุรี",4000,https://dx0z0m6vobblr.cloudfront.net/markets/ตลาดเดินเล่นเพชรเกษม-81/385384_0.jpg,https://thaimarket.biz/markets/ตลาดเดินเล่นเพชรเกษม-81
51,ตลาดบุญเรือง,4.20 (526),"บางใหญ่, นนทบุรี",150,https://dx0z0m6vobblr.cloudfront.net/market/image/image_657bd00685978dbd0e17a58f_1800e738_05b3_4677_b49d_b4358f6d63dd.jpeg,https://thaimarket.biz/markets/ตลาดบุญเรือง
52,ตลาดรัตนพร,3.70 (86),"บางใหญ่, นนทบุรี",70,https://dx0z0m6vobblr.cloudfront.net/markets/ตลาดรัตนพร/366181842_828617278726780_553201638691341786_n - Apinya Noppakun.jpg,https://thaimarket.biz/markets/ตลาดรัตนพร
53,นิวทาวน์ คอมมูนิตีมอลล์ สกลนคร,4.70 (6),"บางใหญ่, นนทบุรี",90,https://dx0z0m6vobblr.cloudfront.net/markets/นิวทาวน์-คอมมูนิตีมอลล์-สกลนคร/1722268224352.jpg,https://thaimarket.biz/markets/นิวทาวน์-คอมมูนิตีมอลล์-สกลนคร
54,พลาซ่า ลากูน,"4.20 (1,706)","บางใหญ่, นนทบุรี",8500,https://dx0z0m6vobblr.cloudfront.net/image_647f0167f24e090cf0b46707_1687844854160.jpeg,https://thaimarket.biz/markets/พลาซ่า-ลากูน
55,ตลาดเลียบคลองสำโรง,4.90 (119),"บางใหญ่, นนทบุรี",4500,https://dx0z0m6vobblr.cloudfront.net/market/image/image_662a211c2bab64bf28b0a8c7_3888bd2d_aa05_44a0_98f4_3e5d8b0903a6.jpg,https://thaimarket.biz/markets/ตลาดเลียบคลองสำโรง
56,Foodie Market Bangna ฟู้ดดี้บางนา,4.70 (7),"บางใหญ่, นนทบุรี",7800,https://dx0z0m6vobblr.cloudfront.net/markets/foodie-market-bangna/Cover Website à¸à¸£à¸±à¸à¹à¸à¸à¹.png,https://thaimarket.biz/markets/foodie-market-bangna
57,ฉำฉา มาร์เก็ต,"4.50 (1,359)","บางใหญ่, นนทบุรี",150,https://dx0z0m6vobblr.cloudfront.net/market/image/image_658512ff2b035add32f2ade6_f654fb67_1d09_4a52_9264_6430d5446dbb.jpg,https://thaimarket.biz/markets/ฉำฉา-มาร์เก็ต
58,ตลาดใหญ่ลำลูกกา,4.00 (684),"บางใหญ่, นนทบุรี",200,https://dx0z0m6vobblr.cloudfront.net/market/image/image_658532132b035add32f2af77_03361530_7df8_4e4b_bbd4_61edb0a2d7d1.jpg,https://thaimarket.biz/markets/ตลาดใหญ่ลำลูกกา
59,ตลาดทูบี มาร์เก็ต หลังเซ็นทรัลพระราม 2,4.60 (22),"บางใหญ่, นนทบุรี",4500,https://dx0z0m6vobblr.cloudfront.net/markets/ตลาดทูบี-มาร์เก็ต-หลังเซ็นทรัลพระราม-2/371985559_122107781984019454_692535481923387016_n.jpg,https://thaimarket.biz/markets/ตลาดทูบี-มาร์เก็ต-หลังเซ็นทรัลพระราม-2
60,ตลาดสดท่าวังทอง,4.20 (534),"บางใหญ่, นนทบุรี",1200,https://dx0z0m6vobblr.cloudfront.net/image_64658df9b031d2ce0da53326_1684388388099.jpeg,https://thaimarket.biz/markets/ตลาดสดท่าวังทอง
61,ตลาดพระเครื่องวงเวียนเล็ก,4.50 (590),"คลองสาน, กรุงเทพมหานคร",965,https://dx0z0m6vobblr.cloudfront.net/market/image/image_65f93e48fafeb5ff589d0fe6_c7ae748f_1067_4a2e_91ca_8d265be8bc53.jpg,https://thaimarket.biz/markets/ตลาดพระเครื่องวงเวียนเล็ก
62,ตลาดประจวบ​จิง​จิง​,4.10 (7),"คลองสาน, กรุงเทพมหานคร",5000,https://dx0z0m6vobblr.cloudfront.net/market/image/image_659bb3d581c46e86f41f8bf7_64fbd713_b373_48f9_8e5e_bbba8d842bdc.png,https://thaimarket.biz/markets/ตลาดประจวบ-จิง-จิง-
63,จิรกานต์ มาร์เก็ต  Jirakarn Market,4.60 (219),"คลองสาน, กรุงเทพมหานคร",150,https://dx0z0m6vobblr.cloudfront.net/markets/จิรกานต์-มาร์เก็ต-jirakarn-market/75317262_2464147707033538_964511322374930432_n.jpg,https://thaimarket.biz/markets/จิรกานต์-มาร์เก็ต-jirakarn-market
64,ตลาดเพชรทองใบ,4.50 (15),"คลองสาน, กรุงเทพมหานคร",120,https://dx0z0m6vobblr.cloudfront.net/markets/ตลาดเพชรทองใบ/451264375_1177750443560179_7626325086003473212_n.jpg,https://thaimarket.biz/markets/ตลาดเพชรทองใบ
65,ตลาดบางกระดี่เฮียชุ้น,4.10 (356),"คลองสาน, กรุงเทพมหานคร",3000,https://dx0z0m6vobblr.cloudfront.net/market/image/image_6594fe99ac52740ecca7b7c9_88975a5e_4d3e_4a5d_ad82_5fad93bde2cb.jpeg,https://thaimarket.biz/markets/ตลาดบางกระดี่เฮียชุ้น
66,ตลาดนัดเจริญทรัพย์รุ่งเรือง ไนท์มาร์เก็ต,4.00 (13),"คลองสาน, กรุงเทพมหานคร",1500,https://dx0z0m6vobblr.cloudfront.net/market/image/image_656fed1e85978dbd0e16f62a_398ecf89_1f4e_43fe_8643_25cc99c5a6a9.jpg,https://thaimarket.biz/markets/ตลาดนัดเจริญทรัพย์รุ่งเรือง-ไนท์มาร์เก็ต
67,ยู อเวนิว  U Avenue,4.30 (28),"คลองสาน, กรุงเทพมหานคร",3000,https://dx0z0m6vobblr.cloudfront.net/market/image/image_6597682381c46e86f41f4dc8_a9fb2e29_6a62_4b32_9c97_3195441c445d.jpg,https://thaimarket.biz/markets/ยู-อเวนิว-u-avenue
68,Market square พันท้ายนรสิงห์,4.30 (39),"คลองสาน, กรุงเทพมหานคร",240,https://dx0z0m6vobblr.cloudfront.net/market/image/image_659d649a50851ce900da78e0_48278781_b6b3_44dd_92e8_c699d480f667.jpg,https://thaimarket.biz/markets/market-square-พันท้ายนรสิงห์
69,ตลาดหน้า ม.  More Market,"4.50 (3,146)","คลองสาน, กรุงเทพมหานคร",2000,https://dx0z0m6vobblr.cloudfront.net/market/image/image_65b0c30672343c8a39bc1c40_43824c83_5634_4374_b446_9d50419aa7dc.jpg,https://thaimarket.biz/markets/ตลาดหน้า-ม-more-market
70,ตลาดพันท้ายมาร์เก็ต,4.60 (42),"คลองสาน, กรุงเทพมหานคร",150,https://dx0z0m6vobblr.cloudfront.net/market/image/image_64670425b031d2ce0da53911_2ae7258e_4d13_4664_ba51_2bfd9c3658c4.png,https://thaimarket.biz/markets/ตลาดพันท้ายมาร์เก็ต
71,ศูนย์การค้าเอ็กซ์โปภูเก็ต EXPO Phuket,3.90 (648),"คลองสาน, กรุงเทพมหานคร",4000,https://dx0z0m6vobblr.cloudfront.net/image_64971255706584a42c0cd023_1687845921605.jpeg,https://thaimarket.biz/markets/ศูนย์การค้าเอ็กซ์โปภูเก็ต-expo-phuket
72,ฟู้ด มาร์เก็ต ตลาดนัดพุทธมณฑลสาย 3,4.20 (293),"คลองสาน, กรุงเทพมหานคร",120,https://dx0z0m6vobblr.cloudfront.net/market/image/image_65a4c2d3b37d5fac995c1c95_ea3bb578_2e57_4eca_962d_8f2876dbc683.jpg,https://thaimarket.biz/markets/ฟู้ด-มาร์เก็ต-ตลาดนัดพุทธมณฑลสาย-3
73,ตลาดนัดซีซ่าร์,0.00 (0),"คลองหลวง, ปทุมธานี",100,https://dx0z0m6vobblr.cloudfront.net/market/image/image_656d4d03ced060148410ea54_1dcef8ad_8448_41d8_a703_ea0980bb4413.jpg,https://thaimarket.biz/markets/ตลาดนัดซีซ่าร์
