MarketId,MarketName,MarketRating,MarketAddress,MarketPrice,UrlImageProfile,LinkDetail
1387,ตลาดบางคราม,4.20 (44),"ธัญบุรี, ปทุมธานี",,https://dx0z0m6vobblr.cloudfront.net/markets/ตลาดบางคราม/1111.jpg,https://thaimarket.biz/markets/ตลาดบางคราม
1388,ตลาดนัดชุมชนโนนบก บริเวณลานตลาดนัดชุมชนบ้านโนนบก ตำบลโนนศิลา อำเภอปากคาด,0.00 (0),"ธัญบุรี, ปทุมธานี",,https://dx0z0m6vobblr.cloudfront.net/markets/ตลาดนัดชุมชนโนนบก-บริเวณลานตลาดนัดชุมชนบ้านโนนบก-ตำบลโนนศิลา-อำเภอปากคาด/2023-07-02.jpg,https://thaimarket.biz/markets/ตลาดนัดชุมชนโนนบก-บริเวณลานตลาดนัดชุมชนบ้านโนนบก-ตำบลโนนศิลา-อำเภอปากคาด
1389,ตลาดสดเทศบาลตำบลนิคมปราสาท,4.40 (31),"ธัญบุรี, ปทุมธานี",,https://dx0z0m6vobblr.cloudfront.net/markets/ตลาดสดเทศบาลตำบลนิคมปราสาท/2018-03-03.jpg,https://thaimarket.biz/markets/ตลาดสดเทศบาลตำบลนิคมปราสาท
1390,ตลาดสดเทศบาลตำบลบ้านกรวด,4.20 (234),"ธัญบุรี, ปทุมธานี",,https://dx0z0m6vobblr.cloudfront.net/markets/ตลาดสดเทศบาลตำบลบ้านกรวด/2022-04-13.jpg,https://thaimarket.biz/markets/ตลาดสดเทศบาลตำบลบ้านกรวด
1391,ตลาดสดอำเภอละหานทราย,4.30 (3),"ธัญบุรี, ปทุมธานี",,https://dx0z0m6vobblr.cloudfront.net/markets/ตลาดสดอำเภอละหานทราย/IMG20240204140439.jpg,https://thaimarket.biz/markets/ตลาดสดอำเภอละหานทราย
1392,ตลาดฮาคุโน๊ะ,4.40 (131),"ธัญบุรี, ปทุมธานี",,https://dx0z0m6vobblr.cloudfront.net/markets/ตลาดฮาคุโน๊ะ/448045283_122149197602170162_3312501776125801466_n.jpg,https://thaimarket.biz/markets/ตลาดฮาคุโน๊ะ
1393,ตลาดเคหะคลอง 6,4.20 (749),"ธัญบุรี, ปทุมธานี",,https://dx0z0m6vobblr.cloudfront.net/markets/ตลาดเคหะคลอง6/2023-02-13.jpg,https://thaimarket.biz/markets/ตลาดเคหะคลอง6
1394,ตลาดสุขอนันต์,4.10 (115),"ธัญบุรี, ปทุมธานี",,https://dx0z0m6vobblr.cloudfront.net/markets/ตลาดสุขอนันต์/2020-05-16.jpg,https://thaimarket.biz/markets/ตลาดสุขอนันต์
1395,ตลาดเย็นเทศบาลตำบลโนนเจริญ,4.60 (8),"ธัญบุรี, ปทุมธานี",,https://dx0z0m6vobblr.cloudfront.net/markets/ตลาดเย็นเทศบาลตำบลโนนเจริญ/DSC_4953.JPG,https://thaimarket.biz/markets/ตลาดเย็นเทศบาลตำบลโนนเจริญ
1396,ตลาดนัดท่าฉาง,4.50 (4),"ธัญบุรี, ปทุมธานี",,https://dx0z0m6vobblr.cloudfront.net/markets/ตลาดนัดท่าฉาง/1111.jpg,https://thaimarket.biz/markets/ตลาดนัดท่าฉาง
1397,ตลาดไนท์บาซ่าประโคนชัย,4.50 (30),"ธัญบุรี, ปทุมธานี",,https://dx0z0m6vobblr.cloudfront.net/markets/ตลาดไนท์บาซ่าประโคนชัย/2019-11-03.jpg,https://thaimarket.biz/markets/ตลาดไนท์บาซ่าประโคนชัย
1398,ตลาดถนนคนเดินเมืองต่ำ,4.80 (5),"ธัญบุรี, ปทุมธานี",,https://dx0z0m6vobblr.cloudfront.net/markets/ตลาดถนนคนเดินเมืองต่ำ/4.jpg,https://thaimarket.biz/markets/ตลาดถนนคนเดินเมืองต่ำ
1399,ตลาดสดเทศบาลศรีวิไล เทศบาลศรีวิไล ถนนพังโคนบึงกาฬ,0.00 (0),"ธัญบุรี, ปทุมธานี",,https://dx0z0m6vobblr.cloudfront.net/markets/ตลาดสดเทศบาลศรีวิไล-เทศบาลศรีวิไล-ถนนพังโคน-บึงกาฬ/461204732_1198440631275050_195893207507886584_n.jpg,https://thaimarket.biz/markets/ตลาดสดเทศบาลศรีวิไล-เทศบาลศรีวิไล-ถนนพังโคน-บึงกาฬ
1400,ตลาดนัดสี่แยกบ้านใหญ่,0.00 (0),"ธัญบุรี, ปทุมธานี",,https://dx0z0m6vobblr.cloudfront.net/markets/ตลาดนัดสี่แยกบ้านใหญ่/1111.jpg,https://thaimarket.biz/markets/ตลาดนัดสี่แยกบ้านใหญ่
1401,ตลาดสดเทศบาลตำบลบ่อพลอย (ตลาดหันใหญ่),4.20 (17),"ธัญบุรี, ปทุมธานี",,https://dx0z0m6vobblr.cloudfront.net/markets/ตลาดสดเทศบาลตำบลบ่อพลอย-ตลาดหันใหญ่-/à¸à¸¥à¸²à¸à¸ªà¸à¹à¸à¸¨à¸à¸²à¸¥à¸à¸³à¸à¸¥à¸à¹à¸­à¸à¸¥à¸­à¸¢.png,https://thaimarket.biz/markets/ตลาดสดเทศบาลตำบลบ่อพลอย-ตลาดหันใหญ่-
1402,ตลาดนัดวัดม่วง,0.00 (0),"ธัญบุรี, ปทุมธานี",,https://dx0z0m6vobblr.cloudfront.net/markets/ตลาดนัดวัดม่วง/11111.jpg,https://thaimarket.biz/markets/ตลาดนัดวัดม่วง
1403,ตลาดชุมชนโนนศิลา,4.50 (12),"ธัญบุรี, ปทุมธานี",,https://dx0z0m6vobblr.cloudfront.net/markets/ตลาดชุมชนโนนศิลา/2021-10-24.jpg,https://thaimarket.biz/markets/ตลาดชุมชนโนนศิลา
1404,ตลาดลานทองสแควร์,4.20 (129),"ธัญบุรี, ปทุมธานี",,https://dx0z0m6vobblr.cloudfront.net/markets/ตลาดลานทองสแควร์/3.jpg,https://thaimarket.biz/markets/ตลาดลานทองสแควร์
1405,ตลาดนัดแยกห้วยกระเจา,4.10 (31),"ห้วยกระเจา, กาญจนบุรี",,https://dx0z0m6vobblr.cloudfront.net/markets/ตลาดนัดแยกห้วยกระเจา/2024-05-13.jpg,https://thaimarket.biz/markets/ตลาดนัดแยกห้วยกระเจา
1406,กาดเอื้ออาทรแม่กวง,4.70 (24),"ห้วยกระเจา, กาญจนบุรี",,https://dx0z0m6vobblr.cloudfront.net/markets/กาดเอื้ออาทรแม่กวง/000.png,https://thaimarket.biz/markets/กาดเอื้ออาทรแม่กวง
1407,ตลาดนัดนครพิงค์,2.60 (471),"ห้วยกระเจา, กาญจนบุรี",,https://dx0z0m6vobblr.cloudfront.net/markets/ตลาดนัดนครพิงค์/2023-01-18 (1).jpg,https://thaimarket.biz/markets/ตลาดนัดนครพิงค์
1408,ตลาดสดชุมชนกาดลื้อ,4.10 (14),"ห้วยกระเจา, กาญจนบุรี",,https://dx0z0m6vobblr.cloudfront.net/markets/ตลาดสดชุมชนกาดลื้อ/2024-07-03.jpg,https://thaimarket.biz/markets/ตลาดสดชุมชนกาดลื้อ
1409,กาดเช้าบ่อสร้าง,4.40 (72),"ห้วยกระเจา, กาญจนบุรี",,https://dx0z0m6vobblr.cloudfront.net/markets/กาดเช้าบ่อสร้าง/000.png,https://thaimarket.biz/markets/กาดเช้าบ่อสร้าง
1410,ตลาดนัดหน้าวัดออนหลวย,3.90 (24),"ห้วยกระเจา, กาญจนบุรี",,https://dx0z0m6vobblr.cloudfront.net/markets/ตลาดนัดหน้าวัดออนหลวย/1727153140626.jpg,https://thaimarket.biz/markets/ตลาดนัดหน้าวัดออนหลวย
1411,ตลาดสดห้วยกระเจา,4.60 (11),"ห้วยกระเจา, กาญจนบุรี",,https://dx0z0m6vobblr.cloudfront.net/markets/ตลาดสดห้วยกระเจา/2024-08-20.jpg,https://thaimarket.biz/markets/ตลาดสดห้วยกระเจา
1412,ตลาดสหกรณ์ 2,4.20 (81),"ห้วยกระเจา, กาญจนบุรี",,https://dx0z0m6vobblr.cloudfront.net/markets/ตลาดสหกรณ์-2/2023-10-21 (2).jpg,https://thaimarket.biz/markets/ตลาดสหกรณ์-2
1413,ตลาดนัดอรสิริน,4.90 (18),"ห้วยกระเจา, กาญจนบุรี",,https://dx0z0m6vobblr.cloudfront.net/markets/ตลาดนัดอรสิริน/2021-02-26.jpg,https://thaimarket.biz/markets/ตลาดนัดอรสิริน
1414,กาดนัดดอยสะเก็ด @ลานวัวชน,4.50 (831),"ห้วยกระเจา, กาญจนบุรี",,https://dx0z0m6vobblr.cloudfront.net/markets/กาดนัดดอยสะเก็ด-ลานวัวชน/459998279_1933120093880060_1996227232573556449_n.jpg,https://thaimarket.biz/markets/กาดนัดดอยสะเก็ด-ลานวัวชน
1415,ตลาดนัดต้นเปา,3.70 (21),"ห้วยกระเจา, กาญจนบุรี",,https://dx0z0m6vobblr.cloudfront.net/markets/ตลาดนัดต้นเปา/2017-10-22.jpg,https://thaimarket.biz/markets/ตลาดนัดต้นเปา
1416,ตลาดนัดวันศุกร์บ้านใหม่,4.40 (78),"ห้วยกระเจา, กาญจนบุรี",,https://dx0z0m6vobblr.cloudfront.net/markets/ตลาดนัดวันศุกร์บ้านใหม่/1687511701887_121_gall_685_Ly3T.jpg,https://thaimarket.biz/markets/ตลาดนัดวันศุกร์บ้านใหม่
1417,ถนนคนเดินสันกำแพง,4.50 (258),"สันกำแพง, เชียงใหม่",,https://dx0z0m6vobblr.cloudfront.net/markets/ถนนคนเดินสันกำแพง/000.png,https://thaimarket.biz/markets/ถนนคนเดินสันกำแพง
1418,ตลาดนัดคลองถม,4.20 (834),"สันกำแพง, เชียงใหม่",,https://dx0z0m6vobblr.cloudfront.net/markets/ตลาดนัดคลองถม/000.png,https://thaimarket.biz/markets/ตลาดนัดคลองถม
1419,ตลาดนัดรุ่งโรจน์ ตำบลดอนแก้ว,"4.70 (8,599)","สันกำแพง, เชียงใหม่",,https://dx0z0m6vobblr.cloudfront.net/markets/ตลาดนัดรุ่งโรจน์-ตำบลดอนแก้ว/000.png,https://thaimarket.biz/markets/ตลาดนัดรุ่งโรจน์-ตำบลดอนแก้ว
1420,ตลาดนัดเวฬุวัน ยางเนิ้ง,4.10 (39),"สันกำแพง, เชียงใหม่",,https://dx0z0m6vobblr.cloudfront.net/markets/ตลาดนัดเวฬุวัน-ยางเนิ้ง/place36502_IMG_20231001_1556073.jpg,https://thaimarket.biz/markets/ตลาดนัดเวฬุวัน-ยางเนิ้ง
1421,ตลาดรวมพล,4.40 (452),"สันกำแพง, เชียงใหม่",,https://dx0z0m6vobblr.cloudfront.net/markets/ตลาดรวมพล/020202.png,https://thaimarket.biz/markets/ตลาดรวมพล
1422,ตลาดโต้รุ่งเมืองพล,4.30 (98),"สันกำแพง, เชียงใหม่",,https://dx0z0m6vobblr.cloudfront.net/markets/ตลาดโต้รุ่งเมืองพล/000.png,https://thaimarket.biz/markets/ตลาดโต้รุ่งเมืองพล
1423,ตลาดสดเทศบาล 4,4.60 (13),"สันกำแพง, เชียงใหม่",,https://dx0z0m6vobblr.cloudfront.net/markets/ตลาดสดเทศบาล-4/000.png,https://thaimarket.biz/markets/ตลาดสดเทศบาล-4
1424,ตลาดนัดบ้านป่างิ้ว,4.60 (230),"สันกำแพง, เชียงใหม่",,https://dx0z0m6vobblr.cloudfront.net/markets/ตลาดนัดบ้านป่างิ้ว/IMG_20220818_134304.jpg,https://thaimarket.biz/markets/ตลาดนัดบ้านป่างิ้ว
1425,ตลาดชุมชนบ้านหนองหญ้าแพรก,4.30 (28),"สันกำแพง, เชียงใหม่",,https://dx0z0m6vobblr.cloudfront.net/markets/ตลาดชุมชนบ้านหนองหญ้าแพรก/000.png,https://thaimarket.biz/markets/ตลาดชุมชนบ้านหนองหญ้าแพรก
1426,ตลาดนัดถนนคนเดินท่าพระ,4.40 (51),"สันกำแพง, เชียงใหม่",,https://dx0z0m6vobblr.cloudfront.net/markets/ตลาดนัดถนนคนเดินท่าพระ/000.png,https://thaimarket.biz/markets/ตลาดนัดถนนคนเดินท่าพระ
1427,ตลาดท่าพระร้อยปี,3.50 (2),"สันกำแพง, เชียงใหม่",,https://dx0z0m6vobblr.cloudfront.net/markets/ตลาดท่าพระร้อยปี/0606.png,https://thaimarket.biz/markets/ตลาดท่าพระร้อยปี
1428,ตลาดนัดท่าพระ,4.40 (14),"สันกำแพง, เชียงใหม่",,https://dx0z0m6vobblr.cloudfront.net/markets/ตลาดนัดท่าพระ/0606.png,https://thaimarket.biz/markets/ตลาดนัดท่าพระ
1429,ตลาดท่าพระเมืองใหม่,4.30 (76),"เมืองขอนแก่น, ขอนแก่น",,https://dx0z0m6vobblr.cloudfront.net/markets/ตลาดท่าพระเมืองใหม่/000.png,https://thaimarket.biz/markets/ตลาดท่าพระเมืองใหม่
1430,ตลาดบ้านขามป้อม,4.00 (27),"เมืองขอนแก่น, ขอนแก่น",,https://dx0z0m6vobblr.cloudfront.net/markets/ตลาดบ้านขามป้อม/020202.png,https://thaimarket.biz/markets/ตลาดบ้านขามป้อม
1431,ตลาดแลงบ้านพระยืน,4.00 (1),"เมืองขอนแก่น, ขอนแก่น",,https://dx0z0m6vobblr.cloudfront.net/markets/ตลาดแลงบ้านพระยืน/000.png,https://thaimarket.biz/markets/ตลาดแลงบ้านพระยืน
1432,ตลาดนัดชุมชนตำบลพระบุ,4.30 (60),"เมืองขอนแก่น, ขอนแก่น",,https://dx0z0m6vobblr.cloudfront.net/markets/ตลาดนัดชุมชนตำบลพระบุ/000.png,https://thaimarket.biz/markets/ตลาดนัดชุมชนตำบลพระบุ
1433,ตลาดแม่จ้อ,4.00 (5),"เมืองขอนแก่น, ขอนแก่น",,https://dx0z0m6vobblr.cloudfront.net/markets/ตลาดแม่จ้อ/0606.png,https://thaimarket.biz/markets/ตลาดแม่จ้อ
1434,ตลาดนัดบ้านยวม,"4.60 (1,094)","เมืองขอนแก่น, ขอนแก่น",,https://dx0z0m6vobblr.cloudfront.net/markets/ตลาดนัดบ้านยวม/2020-03-14.jpg,https://thaimarket.biz/markets/ตลาดนัดบ้านยวม
1435,ถนนคนเดินสารภี,4.40 (170),"เมืองขอนแก่น, ขอนแก่น",,https://dx0z0m6vobblr.cloudfront.net/markets/ถนนคนเดินสารภี/2022-06-25.jpg,https://thaimarket.biz/markets/ถนนคนเดินสารภี
1436,ตลาดนัดต้นเงิน (วันพุธ),0.00 (0),"เมืองขอนแก่น, ขอนแก่น",,https://dx0z0m6vobblr.cloudfront.net/markets/ตลาดนัดต้นเงิน-วันพุธ-/2022-06-29.jpg,https://thaimarket.biz/markets/ตลาดนัดต้นเงิน-วันพุธ-
1437,ตลาดนัดบ้านข้างวัด,"4.40 (2,188)","เมืองขอนแก่น, ขอนแก่น",,https://dx0z0m6vobblr.cloudfront.net/markets/ตลาดนัด-บ้านข้างวัด-/000.png,https://thaimarket.biz/markets/ตลาดนัด-บ้านข้างวัด-
1438,กาดนัดมีโชค,4.00 (3),"เมืองขอนแก่น, ขอนแก่น",,https://dx0z0m6vobblr.cloudfront.net/markets/กาดนัดมีโชค/000.png,https://thaimarket.biz/markets/กาดนัดมีโชค
1439,ตลาดนัดประชารัฐหนองฮ่อ,4.20 (594),"เมืองขอนแก่น, ขอนแก่น",,https://dx0z0m6vobblr.cloudfront.net/markets/ตลาดนัดประชารัฐหนองฮ่อ/000.png,https://thaimarket.biz/markets/ตลาดนัดประชารัฐหนองฮ่อ
1440,ตลาดนัดวัดต้นปิน,4.40 (81),"เมืองขอนแก่น, ขอนแก่น",,https://dx0z0m6vobblr.cloudfront.net/markets/ตลาดนัดวัดต้นปิน/000.png,https://thaimarket.biz/markets/ตลาดนัดวัดต้นปิน
1441,ตลาดประชารัฐท้องถิ่นสุขใจหนองป่าครั่ง,4.20 (282),"เมืองเชียงใหม่, เชียงใหม่",,https://dx0z0m6vobblr.cloudfront.net/markets/ตลาดประชารัฐท้องถิ่นสุขใจหนองป่าครั่ง/000.png,https://thaimarket.biz/markets/ตลาดประชารัฐท้องถิ่นสุขใจหนองป่าครั่ง
1442,ตลาดเทศบาลตำบลพระยืน,4.60 (10),"เมืองเชียงใหม่, เชียงใหม่",,https://dx0z0m6vobblr.cloudfront.net/markets/ตลาดเทศบาลตำบลพระยืน/000.png,https://thaimarket.biz/markets/ตลาดเทศบาลตำบลพระยืน
1443,ตลาดสดเทศบาลตำบลมัญจาคีรี,4.40 (17),"เมืองเชียงใหม่, เชียงใหม่",,https://dx0z0m6vobblr.cloudfront.net/markets/ตลาดสดเทศบาลตำบลมัญจาคีรี/000.png,https://thaimarket.biz/markets/ตลาดสดเทศบาลตำบลมัญจาคีรี
1444,ตลาดสดมัญจาคีรี,4.10 (398),"เมืองเชียงใหม่, เชียงใหม่",,https://dx0z0m6vobblr.cloudfront.net/markets/ตลาดสดมัญจาคีรี/000.png,https://thaimarket.biz/markets/ตลาดสดมัญจาคีรี
1445,ตลาดสด อบต. บ้านหว้า,4.50 (2),"เมืองเชียงใหม่, เชียงใหม่",,https://dx0z0m6vobblr.cloudfront.net/markets/ตลาดสด-อบต-บ้านหว้า/000.png,https://thaimarket.biz/markets/ตลาดสด-อบต-บ้านหว้า
1446,ตลาดทรัพย์สินทวี,5.00 (2),"เมืองเชียงใหม่, เชียงใหม่",,https://dx0z0m6vobblr.cloudfront.net/markets/ตลาดทรัพย์สินทวี/000.png,https://thaimarket.biz/markets/ตลาดทรัพย์สินทวี
1447,ตลาดสดชุมชนบ้านทุ่ม,4.20 (168),"เมืองเชียงใหม่, เชียงใหม่",,https://dx0z0m6vobblr.cloudfront.net/markets/ตลาดสดชุมชนบ้านทุ่ม/000.png,https://thaimarket.biz/markets/ตลาดสดชุมชนบ้านทุ่ม
1448,ตลาดกลางคำหญ้าแดง,4.40 (137),"เมืองเชียงใหม่, เชียงใหม่",,https://dx0z0m6vobblr.cloudfront.net/markets/ตลาดกลางคำหญ้าแดง/020202.png,https://thaimarket.biz/markets/ตลาดกลางคำหญ้าแดง
1449,ตลาดนัดชุมชนตำบลบ้านเหล่า,5.00 (9),"เมืองเชียงใหม่, เชียงใหม่",,https://dx0z0m6vobblr.cloudfront.net/markets/ตลาดนัดชุมชนตำบลบ้านเหล่า/000.png,https://thaimarket.biz/markets/ตลาดนัดชุมชนตำบลบ้านเหล่า
1450,ตลาดนัดบิ๊กซีดอนจั่นไนท์มาร์เก็ต,4.80 (175),"เมืองเชียงใหม่, เชียงใหม่",,https://dx0z0m6vobblr.cloudfront.net/markets/ตลาดนัดบิ๊กซีดอนจั่นไนท์มาร์เก็ต/3333.png,https://thaimarket.biz/markets/ตลาดนัดบิ๊กซีดอนจั่นไนท์มาร์เก็ต
1451,ตลาดสดเทศบาลบ้านฝาง,4.70 (183),"เมืองเชียงใหม่, เชียงใหม่",,https://dx0z0m6vobblr.cloudfront.net/markets/ตลาดสดเทศบาลบ้านฝาง/000.png,https://thaimarket.biz/markets/ตลาดสดเทศบาลบ้านฝาง
1452,ตลาดนัดดอนโมง,3.80 (11),"เมืองเชียงใหม่, เชียงใหม่",,https://dx0z0m6vobblr.cloudfront.net/markets/ตลาดนัดดอนโมง/050505.png,https://thaimarket.biz/markets/ตลาดนัดดอนโมง
1453,ตลาดนัดสามแยกภูเวียง,3.60 (7),"หนองเรือ, ขอนแก่น",,https://dx0z0m6vobblr.cloudfront.net/markets/ตลาดนัดสามแยกภูเวียง/000.png,https://thaimarket.biz/markets/ตลาดนัดสามแยกภูเวียง
1454,ตลาดนัดบ้านจระเข้,3.50 (2),"หนองเรือ, ขอนแก่น",,https://dx0z0m6vobblr.cloudfront.net/markets/ตลาดนัดบ้านจระเข้/050505.png,https://thaimarket.biz/markets/ตลาดนัดบ้านจระเข้
1455,ตลาดบ้านเม็ง,4.40 (11),"หนองเรือ, ขอนแก่น",,https://dx0z0m6vobblr.cloudfront.net/markets/ตลาดบ้านเม็ง/020202.png,https://thaimarket.biz/markets/ตลาดบ้านเม็ง
1456,ตลาดต้นจาน,0.00 (0),"หนองเรือ, ขอนแก่น",,https://dx0z0m6vobblr.cloudfront.net/markets/ตลาดต้นจาน/050505.png,https://thaimarket.biz/markets/ตลาดต้นจาน
1457,ตลาดสดเทศบาลตำบลหนองแก,4.10 (116),"หนองเรือ, ขอนแก่น",,https://dx0z0m6vobblr.cloudfront.net/markets/ตลาดสดเทศบาลตำบลหนองแก/000.png,https://thaimarket.biz/markets/ตลาดสดเทศบาลตำบลหนองแก
1458,ตลาดกลางลานค้าชุมชน,4.00 (8),"หนองเรือ, ขอนแก่น",,https://dx0z0m6vobblr.cloudfront.net/markets/ตลาดกลางลานค้าชุมชน/000.png,https://thaimarket.biz/markets/ตลาดกลางลานค้าชุมชน
1459,ตลาดกกเกลือ,4.70 (3),"หนองเรือ, ขอนแก่น",,https://dx0z0m6vobblr.cloudfront.net/markets/ตลาดกกเกลือ/000.png,https://thaimarket.biz/markets/ตลาดกกเกลือ
1460,ตลาดสามพี่น้อง บ้านนาฝายเหนือ,4.00 (6),"หนองเรือ, ขอนแก่น",,https://dx0z0m6vobblr.cloudfront.net/markets/ตลาดสามพี่น้อง-บ้านนาฝายเหนือ/000.png,https://thaimarket.biz/markets/ตลาดสามพี่น้อง-บ้านนาฝายเหนือ
1461,ตลาดสด ภูผาม่าน,4.20 (70),"หนองเรือ, ขอนแก่น",,https://dx0z0m6vobblr.cloudfront.net/markets/ตลาดสด-ภูผาม่าน/000.png,https://thaimarket.biz/markets/ตลาดสด-ภูผาม่าน
